Product ID,Title,Author/SKU,ISBN/Barcode,Inventory,Unfulfilled Qty,Collections
gid://shopify/Product/5238735274117,OP: Art Culinaire #14,Art Culinaire,ART CU 14,0,0,
gid://shopify/Product/5238735569029,OP: Art Culinaire #85,Art Culinaire,ART CU 85,0,0,
gid://shopify/Product/5238736126085,OP: Art Culinaire #123,Art Culinaire,ART CU 123,0,0,
gid://shopify/Product/5238736191621,OP: Art Culinaire #124,Art Culinaire,ART CU 124,0,0,
gid://shopify/Product/5238736257157,OP: Art Culinaire #129,Art Culinaire,ART CU 129,0,0,
gid://shopify/Product/5238737961093,At Balthazar: The New York Brasserie at the Center of the World,Reggie Nadelson,9781501116773,0,0,
gid://shopify/Product/5238737993861,At Home in the Whole Food Kitchen: Celebrating the Art of Eating Well,Amy Chaplin,9781611800852,0,0,
gid://shopify/Product/5238738321541,Atrio,Toño Pérez & Jose Polo,9788472121744,0,0,
gid://shopify/Product/5238738976901,OP: Bachour the Baker,Antonio Bachour,9780933477537,0,0,
gid://shopify/Product/5238740910213,The Basque Book; A Love Letter in Recipes from the Kitchen of Txikito,Alexandra Raij & Eder Montero,9781607747611,0,0,
gid://shopify/Product/5238741926021,Benu,Corey Lee,9780714868868,0,0,
gid://shopify/Product/5238743728261,Bill's Quiet Revolution: A Japanese American Artisan of California Cuisine,Sam Nakahira,9780359867493,0,0,
gid://shopify/Product/5238743924869,A Bird in the Hand,Diana Henry,9781784720025,0,0,
gid://shopify/Product/5238744744069,OP: Bleu Chocolat (2 vols),Stephane Leroux,9789085867319,0,0,
gid://shopify/Product/5238745366661,"The Book of Boiled Meats Vol 3: Beef, Pork and Game",Stuart Peachey,1858041473,0,0,
gid://shopify/Product/5238745399429,The Book of Boiled Meats Vol 1: Fish,Stuart Peachey,1858041449,0,0,
gid://shopify/Product/5238745432197,The Book of Boiled Meats Vol 2: Mutton and Lamb,Stuart Peachey,1858041465,0,0,
gid://shopify/Product/5238745464965,"The Book of Boiled Meats Volume 4: Poultry and Wildfowl,",Stuart Peachey,185804149X,0,0,
gid://shopify/Product/5238745497733,The Book of Biscuits and Cakes: 1580-1660,Stuart Peachey,1858040833,0,0,
gid://shopify/Product/5238746054789,"The Book of Pies, Volume 1 Pastry and Meat Pies: 1580-1660",Stuart Peachey,1858040582,0,0,
gid://shopify/Product/5238746218629,"The Book of Roasts, 1580-1660",Stuart Peachey,1858040701,0,0,
gid://shopify/Product/5238746316933,The Book of Schmaltz: Love Song to a Forgotten Fat,Michael Ruhlman,9780316254083,0,0,
gid://shopify/Product/5238746841221,Bountiful Empire: A History of Ottoman Cuisine,Priscilla Mary Isin,9781780239040,2,0,
gid://shopify/Product/5238747496581,The Bread and Salt Between Us,Mayada Anjari with Jennifer Sit,9781891105630,0,0,
gid://shopify/Product/5238749069445,Bullipedia: What Is Cooking (Signed Edition),Ferran Adrià,9781838661861,0,0,
gid://shopify/Product/5238749266053,Burma: Rivers of Flavor,Naomi Duguid,9781579654139,2,0,
gid://shopify/Product/5238749593733,Butchering Poultry Rabbit Lamb Goat Pork: The Comprehensive Photographic Guide (Hardcover),Adam Danforth,9781612121888,3,0,
gid://shopify/Product/5238752149637,Catalan Food: Culture & Flavors from the Mediterranean,Daniel Olivella,9780451495884,0,0,
gid://shopify/Product/5238754869381,The Chile Pepper in China,Brian R. Dott,9780231195324,1,0,
gid://shopify/Product/5238755950725,Claire Heitzler Patissiere (French Language),Carole-Anne Boisseau,9782812313554,0,0,
gid://shopify/Product/5238756868229,Clémentine in the Kitchen,Samuel Chamberlain,9781567926460,4,0,
gid://shopify/Product/5238761160837,Cooking in Iran: Regional Recipes & Kitchen Secrets,Najmieh Batmanglij,9781949445077,2,0,
gid://shopify/Product/5238761324677,Cooking South of the Clouds: Recipes and Stories from China's Yunnan Province,Georgia Freeman,9781909487789,0,0,
gid://shopify/Product/5238763356293,OP: Cucina del Mare,Evan Kleiman,,0,0,
gid://shopify/Product/5238768238725,Dining Out: A Global History of Restaurants,Katie Rawson & Elliott Shore,9781789140576,0,0,
gid://shopify/Product/5238768304261,Dining With the Maharajas: A Thousand Years of Culinary Tradition,Neha Prasada,9788174368744,0,0,
gid://shopify/Product/5238768664709,"OP: Dirt (hardcover, signed)",Bill Buford,9780307271013,0,0,
gid://shopify/Product/5238769090693,Down and Out in Paris and London,George Orwell,9780156262248,2,0,
gid://shopify/Product/5238769156229,"Downtown Italian: Recipes Inspired by Italy, Created in New York's West Village","Joe Campanale, Gabriel Thompson & Katherine Thompson",9781449450342,0,0,
gid://shopify/Product/5238771908741,Edible Schoolyard,Alice Waters,9780811862806,0,0,
gid://shopify/Product/5238772072581,Edna Lewis: At the Table With an American Original (hardcover),Sara Franklin,9781469638553,1,0,
gid://shopify/Product/5238772400261,elBulli 2005-2011,Ferran Adrià,9780714865485,0,0,
gid://shopify/Product/5238773743749,Essential Cuisine [English Edition from France],Michel Bras,9782841569359,8,0,
gid://shopify/Product/5238774399109,Every Grain of Rice: Simple Chinese Home Cooking,Fuchsia Dunlop,9780393089042,4,0,
gid://shopify/Product/5238776299653,Feast & Fast: The Art of Food in Europe 1500-1800,Victori Avery & Dr. Melissa Calaresu,9781781301029,2,0,
gid://shopify/Product/5238776332421,Feast and Banquet Menus 1580-1660,Stuart Peachey,1858040051,0,0,
gid://shopify/Product/5238776430725,OP: The Feast of Santa Fe,Huntley Dent,,0,0,
gid://shopify/Product/5238776594565,Feasting and Fasting: The History and Ethics of Jewish Food,"Aaron S. Gross, Jody Myers & Jordan D. Rosenblum",9781479827794,1,0,
gid://shopify/Product/5238776856709,Festivals and Feasts of the Common Man 1550-1660,Stuart Peachey,1858040949,0,0,
gid://shopify/Product/5238778724485,"Flavorwalla: Big Flavor, Bold Spices. a New Way to Cook the Foods You Love",Floyd Cardoz,9781579656218,0,0,
gid://shopify/Product/5238779412613,Food & Beer,Daniel Burns & Jeppe Jarnit-Bjergso,9780714871059,0,0,
gid://shopify/Product/5238782623877,OP: Foods of Sicily & Sardinia and the Smaller Islands,Giuliano Bugialli,,0,0,
gid://shopify/Product/5238782754949,Fool #5,Fool,FOOL 5,0,0,
gid://shopify/Product/5238783606917,Franklin Barbecue: A Meat-smoking Manifesto,Aaron Franklin & Jordan MacKay,9781607747208,1,0,
gid://shopify/Product/5238783803525,The French Chef Handbook: La Cuisine De Reference,Michel Maincent-Morel,9782857086956,0,0,
gid://shopify/Product/5238785245317,"From Scratch: 10 Meals, 175 Recipes, and Dozens of Techniques You Will Use Over",Michael Ruhlman,9781419732775,0,0,
gid://shopify/Product/5238785900677,Fruity Pastry,Kris Goegebeur,9789401402361,0,0,
gid://shopify/Product/5238786064517,OP: Further Adventures in Search of Perfection,Heston Blumenthal,9780747594055,0,0,
gid://shopify/Product/5238786818181,The Gefilte Manifesto: New Recipes for Old World Jewish Foods,Jeffrey Yoskowitz & Liz Alpern,9781250071385,0,0,
gid://shopify/Product/5238788292741,Gnocchi Solo Gnocchi: A Comprehensive Tribute to Italy's Other Favorite First Course,Christine Y. Hickman,9780692110928,0,0,
gid://shopify/Product/5238789636229,Le Grand Livre De La Viennoiserie,"Jeremy Ballester, Jean-Marie Lanio, Olivier Magne, and Thomas Marie",9782379450440,0,0,
gid://shopify/Product/5238789832837,Grandma Grandpa Cook,Yeung Yang & Evelyna Liang,9789881858399,0,0,
gid://shopify/Product/5238790357125,OP: The Great Scandinavian Baking Book,Beatrice Ojakangas,,0,0,
gid://shopify/Product/5238792618117,OP: Heston's Fantastical Feasts,Heston Blumenthal,9781608193691,0,0,
gid://shopify/Product/5238794289285,Honey & Co. at Home: Middle Eastern Recipes from Our Kitchen,Sarit & Srulovich Packer,9781911595663,0,0,
gid://shopify/Product/5238794322053,"Honey from a Weed: Fasting and Feasting in Tuscany, Catalonia, The Cyclades and Apulia (paperback)",Patience Gray,9781903018200,5,0,
gid://shopify/Product/5238795206789,OP: How to Be a Domestic Goddess: Baking and the Art of Comfort Cooking,Nigella Lawson,,0,0,
gid://shopify/Product/5238797238405,Ice Creations,Christophe Declercq,9789401404020,0,0,
gid://shopify/Product/5238798319749,India Cookbook,Pushpesh Pant,9780714859026,0,0,
gid://shopify/Product/5238798352517,"Indian Cooking Unfolded: A Master Class in Indian Cooking, With 100 Easy Recipes",Raghavan Iyer,9780761165217,0,0,
gid://shopify/Product/5238798418053,The Indian Family Kitchen; Classic Dishes for a New Generation,Anjali Pathak,9780804188265,0,0,
gid://shopify/Product/5238798549125,OP: Indian-Jewish Cooking,Mavis Hyman,,0,0,
gid://shopify/Product/5238799204485,Irene's Peranakan Recipes,Irene Yeo,9789810570156,2,0,
gid://shopify/Product/5238799564933,Istanbul & Beyond: Exploring the Diverse Cuisines of Turkey,Robyn Eckhardt,9780544444317,0,0,
gid://shopify/Product/5238800023685,Italian Olive Oil Tins/Lattine Italiane Per Olio D'oliva: 1860-1960,Manuela Guateli Giamminola,9788836642021,1,0,
gid://shopify/Product/5238800580741,James Beard's American Cookery (hardcover),James Beard,9780316098687,0,0,
gid://shopify/Product/5238800777349,Japan: The Cookbook,Nancy Singleton Hachisu,9780714874746,2,0,
gid://shopify/Product/5238800941189,"Japanese Home Cooking: Simple Meals, Authentic Flavors",Sonoko Sakai,9781611806168,2,0,
gid://shopify/Product/5238801465477,OP: Jean-Louis: Cooking With the Seasons,Fred J. Maroon,,0,0,
gid://shopify/Product/5238802022533,Johnny Zucchini & Friends,Johnny Iuzzini,JOHNNY,0,0,
gid://shopify/Product/5238802776197,"Joys of Jewish Preserving, The: Modern Recipes With Traditional Roots",Emily Paster,9781558328754,0,0,
gid://shopify/Product/5238803464325,Karen Torosyan: Secrets Et Techniques D'un Cuisinier Orfevre,Chihiro Masui & Richard Haughton,9782081473348,0,0,
gid://shopify/Product/5238804381829,Kitchen Confidential: Adventures in the Culinary Underbelly,Anthony Bourdain,9780060899226,0,0,
gid://shopify/Product/5238806052997,Land of Fish and Rice: Recipes from the Culinary Heart of China,Fuchsia Dunlop,9780393254389,3,0,
gid://shopify/Product/5238807429253,Let's Cook French: A Family Cookbook/ Cuisinons Francais Un Livre Pour Toute La,Claudine Pepin,9781631591471,0,0,
gid://shopify/Product/5238807658629,Letters to a Young Chef: New and Updated Edition,Daniel Boulud,9780465093427,3,0,
gid://shopify/Product/5238809329797,Lombardia in Cucina,Paola Baccetti,9788895218908,1,0,
gid://shopify/Product/5238810083461,OP: Lucky Peach Vol 11,Peter Meehan and Editors,LUCKY 11,0,0,
gid://shopify/Product/5238810181765,OP: Lucky Peach Vol 19,Peter Meehan and Editors,LUCKY 19,0,0,
gid://shopify/Product/5238810247301,OP: Lucky Peach Vol 5,Peter Meehan and Editors,LUCKY 5,0,0,
gid://shopify/Product/5238810280069,OP: Lucky Peach Vol 6,Peter Meehan and Editors,LUCKY 6,0,0,
gid://shopify/Product/5238810345605,Lulu's Provencal Table (Paperback),Richard Olney,9781911621195,2,0,
gid://shopify/Product/5238810706053,Madam Choy's Cantonese Recipes,Wai Yuen Choy,9789810594022,1,0,
gid://shopify/Product/5238810738821,Madam Krishnan's South Indian Recipes,Ambrose Krishnan,9789810897352,0,0,
gid://shopify/Product/5238812901509,OP: Marcella Cucina,Marcella Hazan,9780060171032,0,0,
gid://shopify/Product/5238812934277,OP: Marcella Says,Marcella Hazan,,0,0,
gid://shopify/Product/5238815981701,OP: Menus for Chez Panisse: The Art & Letterpress of Patricia Curtan,Patricia Curtan,9781616890292,0,0,
gid://shopify/Product/5238816014469,Mercados: Recipes from the Markets of Mexico,David Sterling,9781477310403,2,0,
gid://shopify/Product/5238816342149,Mexico from the Inside Out,Enrique Olvera,9780714869568,0,0,
gid://shopify/Product/5238816637061,Michael Symon's 5 in 5,Michael Symon,9780770434328,2,0,
gid://shopify/Product/5238822011013,OP: My Life in France (hardcover),Julia Child & Alex Prud'homme,,0,0,
gid://shopify/Product/5238823452805,New Basics Cookbook (Paperback),Julee Rosso & Sheila Lukins,9780894803413,2,0,
gid://shopify/Product/5238823518341,The New Book of Middle Eastern Food (2000),Claudia Roden,9780375405068,1,0,
gid://shopify/Product/5238824206469,The New Persian Kitchen,Louisa Shafia,9781607743576,0,0,
gid://shopify/Product/5238825058437,Nez #1: Pour Une Culture Olfactive,Nez & Idm-lmr,9782370630445,0,0,
gid://shopify/Product/5238825091205,Nez #2: le Propre et le Sale,Nez & Idm-lmr,9782370630490,0,0,
gid://shopify/Product/5238825123973,Nez #3: The Sex of Scent,Nez & Idm-lmr,9782370630575,2,0,
gid://shopify/Product/5238825156741,Nez #5: Natural vs. Synthetic,Nez & Idm-lmr,9782370630643,1,0,
gid://shopify/Product/5238825189509,Nez #7: The Animal Sense,Nez & Idm-lmr,9782370630766,3,0,
gid://shopify/Product/5238825222277,Nez #8: Addictive Substances,Nez & Idm-lmr,9782370630865,1,0,
gid://shopify/Product/5238825255045,Nez #9: Around the World,Nez & Idm-lmr,9782491567019,1,0,
gid://shopify/Product/5238826074245,Nopi,Yotam Ottolenghi,9781607746232,2,0,
gid://shopify/Product/5238826238085,Nose Dive: A Field Guide to the World's Smells (hardcover),Harold Mcgee,9781594203954,0,0,
gid://shopify/Product/5238826598533,Nothing Fancy: The Art of Having People Over,Alison Roman,9780451497017,1,0,
gid://shopify/Product/5238828564613,"One Tin Bakes: Sweet and Simple Traybakes, Pies, Bars and Buns",Edd Kimber,9780857838599,0,0,
gid://shopify/Product/5238828859525,Open Kitchen: Inspired Food for Casual Gatherings,Susan Spungen,9780525536673,1,0,
gid://shopify/Product/5238829449349,Our Lady of Perpetual Hunger: A Memoir,Lisa Donovan,9780525560944,0,0,
gid://shopify/Product/5238830334085,Le Pain De La Terre a La Table,Christophe Vasseur,9782955742808,0,0,
gid://shopify/Product/5238831251589,OP: Paris Sweets: Great Desserts from the City's Best Pastry Shops,Dorie Greenspan,,0,0,
gid://shopify/Product/5238831612037,Pasta Pane Vino: Deep Travels Through Italy's Food Culture,Matt Goulding,9780062655097,2,0,
gid://shopify/Product/5238832103557,Pastry Revolution 35,Montagud Editores,PASTRY 35,0,0,
gid://shopify/Product/5238832234629,Pastry Revolution 42,Montagud Editores,PASTRY 42,0,0,
gid://shopify/Product/5238832627845,La Patisserie De Yann Couvreur,Yann Couvreur,9782263152375,0,0,
gid://shopify/Product/5238833676421,Perfection Salad: Women and Cooking at the Turn of the Century,Laura Shapiro,9780520257382,-1,0,
gid://shopify/Product/5238834167941,"Petite Patisserie: Bon Bons, Petits Fours, Macarons and Other Whimsical Bite-Size Treats",Cheryl Wakerhauser,9781645670421,0,0,
gid://shopify/Product/5238834462853,OP: The Picayune's Creole Cook Book,The Picayune,9781449431716,0,0,
gid://shopify/Product/5238836035717,"OP: Plenty (UK edition, signed)",Yotam Ottolenghi,9780091933685,0,0,
gid://shopify/Product/5238838657157,Provence to Pondicherry: Recipes from France and Faraway`,Tessa Kiros,9781849497237,0,0,
gid://shopify/Product/5238838984837,Punch: The Delights and Dangers of the Flowing Bowl,David Wondrich,9780399536168,0,0,
gid://shopify/Product/5238841540741,The Restaurant: A 2000-year History of Dining Out,William Sitwell,9781635766998,0,0,
gid://shopify/Product/5238842327173,"Ritz & Escoffier: The Hotelier, the Chef & the Rise of the Leisure Class (Paperback)",Luke Barr,9780804186315,1,0,
gid://shopify/Product/5238843441285,Robin's Eurasian Recipes,Robin Pereira,9789810842741,3,0,
gid://shopify/Product/5238843572357,Roma in Cucina,Paola Baccetti,9788895218915,0,0,
gid://shopify/Product/5238843703429,Room for Dessert,Will Goldfarb,9780714876405,0,0,
gid://shopify/Product/5238844391557,Russ & Daughters: Reflections and Recipes from the House That Herring Built,Mark Russ Federman,9780805242942,1,0,
gid://shopify/Product/5238845407365,Salt: A World History (paperback),Mark Kurlansky,9780142001615,3,0,
gid://shopify/Product/5238845472901,OP: Saltwater Foodways,Sandra Oliver,,0,0,
gid://shopify/Product/5238846718085,Scent of a Table,Kwang Hee Lee,9791195678655,0,0,
gid://shopify/Product/5238846750853,Scents and Flavors: A Syrian Cookbook,Charles Perry,9781479856282,1,0,
gid://shopify/Product/5238847176837,"The Scots Kitchen, Its Traditions and Recipes",F. Marian Mcneill,9781780273013,0,0,
gid://shopify/Product/5238850191493,Sicilian Summer: An Adventure in Cooking With My Grandsons,Mary Taylor Simeti,9780692108659,0,0,
gid://shopify/Product/5238850781317,Simple Thai Food: Classic Recipes from the Thai Home Kitchen,Leela Punyaratabandhu,9781607745235,1,0,
gid://shopify/Product/5238851698821,"Small Victories: Recipes, Advice + Hundreds of Ideas for Home-cooking Triumphs",Julia Turshen,9781452143095,0,0,
gid://shopify/Product/5238852518021,OP: So Good #3,Vilbo,SO GO 3,0,0,
gid://shopify/Product/5238852583557,OP: So Good #6,Vilbo,SO GO 6,0,0,
gid://shopify/Product/5238853566597,Sous-Vide at Home: The Modern Technique for Perfectly Cooked Meals,Lisa Q. Fetterman,9780399578069,0,0,
gid://shopify/Product/5238855204997,Still Life 1000 Piece Puzzle,Alice Oehr,9781743796665,0,0,
gid://shopify/Product/5238856482949,Summers Under the Tamarind Tree: Recipes & Memories from Pakistan,Sumayya Usmani,9780711236783,0,0,
gid://shopify/Product/5238856876165,Supper of the Lamb (paperback),Robert Farrar Capon,9780375760563,4,0,
gid://shopify/Product/5238856974469,OP: Sushi and Susci,Moreno Cedroni,,0,0,
gid://shopify/Product/5238857302149,Sweet Concepts; Pastry Book,Gregory Doyen,9780933477773,0,0,
gid://shopify/Product/5238857957509,Sweetology,Josep Maria Rodriguez,9788472121522,0,0,
gid://shopify/Product/5238860021893,"Taste of Persia: A Cook's Travels Through Armenia, Azerbaijan, Georgia, Iran, and Kurdistan",Naomi Duguid,9781579655488,0,0,
gid://shopify/Product/5238860513413,Tasting Paris: 100 Recipes to Eat Like a Local,Clothilde Dusoulier,9780451499141,0,0,
gid://shopify/Product/5238861037701,"Teen Kitchen, The: Recipes We Love to Cook",Emily & Lyla Allen,9780399581878,0,0,
gid://shopify/Product/5238861103237,Tel Aviv: Food. People. Stories.,Haya Molcho & Elihay Biran,9781788840293,0,0,
gid://shopify/Product/5238862577797,Together: Our Community Cookbook (foreword by HRH the Duchess of Sussex),Hubb Community Kitchen,9781984824080,0,0,
gid://shopify/Product/5238862610565,Tokyo Cult Recipes,Maori Murota,9780062446688,0,0,
gid://shopify/Product/5238862905477,Too Good to Passover: Sephardic and Judeo-arabic Seder Menus and Memories from a,Jennifer Felicia Abadi,9781977739711,9,0,
gid://shopify/Product/5238863003781,Toothache Magazine #2,Toothache Editors,TOOTH 2,0,0,
gid://shopify/Product/5238863036549,Toothache Magazine #7,Toothache Editors,TOOTH 7,0,0,
gid://shopify/Product/5238864969861,Uncle Lau's Teochew Recipes,Chiap Khai Lau,9789810716165,0,0,
gid://shopify/Product/5238865657989,V Is for Vegetables: Inspired Recipes & Techniques for Home Cooks from Artichokes,Michael Anthony,9780316373357,0,0,
gid://shopify/Product/5238867132549,Venezia in Cucina: The Flavours of Venice,Cinzia Armanini & A. Magris,9788895218427,3,0,
gid://shopify/Product/5238867558533,"Vietnamese Food, Any Day: Simple Recipes for True, Fresh Flavors",Andrea Nguyen,9780399580352,2,0,
gid://shopify/Product/5238868148357,Virgin Territory: Exploring the World of Olive Oil,Nancy Harmon Jenkins,9781118203224,0,0,
gid://shopify/Product/5238869262469,What to Drink With What You Eat,Andrew Dornenberg and Karen Page,9780821257180,1,0,
gid://shopify/Product/5238869590149,When French Women Cook (paperback),Madeleine Kamman,9781580083652,1,0,
gid://shopify/Product/5238869655685,"Where There's Smoke: Simple, Sustainable, Delicious Grilling",Barton Seaver,9781402797057,0,0,
gid://shopify/Product/5238872178821,OP: Writing at the Kitchen Table,Artemis Cooper,,0,0,
gid://shopify/Product/5238887121029,The 100 Most Jewish Foods: With 60 Recipes for Everything from Kugel to Kubbeh,Alana Newhouse,9781579659066,1,0,
gid://shopify/Product/5238887350405,7000 Islands: Cherished Reicpes and Stories from the Philippines,Yasmine Newman,9781743794913,0,0,
gid://shopify/Product/5238887874693,Ambrosia Vol. 5,Ambrosia,AMBRO 5,0,0,
gid://shopify/Product/5238888202373,Andy Warhol Banana Puzzle,Andy Warhol,9780735359987,0,0,
gid://shopify/Product/5238888235141,Andy Warhol Campbell's Soup Puzzle,Andy Warhol,9780735359970,0,0,
gid://shopify/Product/5238890037381,OP: Art Culinaire #125,Art Culinaire,ART CU 125,0,0,
gid://shopify/Product/5238890496133,Artichoke Floral Puzzle,Sarah Phillips,9780735357792,0,0,
gid://shopify/Product/5238891872389,Black Sea: Dispatches and Recipes Through Darkness and Light,Caroline Eden,9781787131316,0,0,
gid://shopify/Product/5238892560517,The Broad Fork; Recipes for the Wide World of Vegetables and Fruits,Hugh Acheson,9780385345026,0,0,
gid://shopify/Product/5238894166149,Chocolat: From the Cocoa Bean to the Chocolate Bar,Pierre Marcolini,9780847859283,0,0,
gid://shopify/Product/5238895935621,Cucinaria: Letters from the Kitchen,Marialucia Luongo,CUCINA,0,0,
gid://shopify/Product/5238896230533,The Dairy: 1580-1660,Rob Stuart,1858041635,0,0,
gid://shopify/Product/5238896885893,Drift Vol. 8: London,Drift Editors,DRIFT 8,0,0,
gid://shopify/Product/5238897639557,Estela,Ignacio Mattos & Gabe Ulla,9781579656706,0,0,
gid://shopify/Product/5238898327685,Feed the Resistance: Recipes + Ideas for Getting Involved,Julia Turshen,9781452168388,0,0,
gid://shopify/Product/5238898589829,Fire and Ice: Classic Nordic Cooking,Darra Goldstein,9781607746102,1,0,
gid://shopify/Product/5238899146885,Food Fortunes,Josh Lafayette,9781452150567,0,0,
gid://shopify/Product/5238899441797,OP: Fool #3,Fool,FOOL 3,0,0,
gid://shopify/Product/5238899933317,From the Markets of Tuscany: A Cookbook,Giulia Scarpaleggia,9788867532193,0,0,
gid://shopify/Product/5238900752517,Hibiscus,Lope Ariyo,9780008225384,0,0,
gid://shopify/Product/5238901538949,Indo Dutch Kitchen Secrets: Stories and Favorite Family Recipes from Stroopwafel,Jeff Keasberry,9781631778803,0,0,
gid://shopify/Product/5238901801093,The Island Kitchen: Recipes from Mauritius and the Indian Ocean,Selina Periampillai,9781526601384,0,0,
gid://shopify/Product/5238902128773,Jarry 2,Jarry Editors,JARRY 2,5,0,
gid://shopify/Product/5238902292613,Jerusalem,Yotam Ottolenghi,9781607743941,4,0,
gid://shopify/Product/5238902947973,Joy of Cooking: The Trusted Kitchen Classic for a New Generation (2019),Irma S. Rombauer,9781501169717,2,0,
gid://shopify/Product/5238903210117,Kecap Manis: Indonesia's National Condiment,Bondan Winarno,9786026990020,3,0,
gid://shopify/Product/5238903308421,Khazana: A Treasure Trove of Modern Mughal Dishes,Saliha Mahmood Ahmed,9781473678569,0,0,
gid://shopify/Product/5238903341189,The King's Peas: Delectable Recipes and Their Stories from the Age of Enlightenment,Meredith Chilton,9783897905603,0,0,
gid://shopify/Product/5238903373957,"Kitchen Creativity: Unlocking Culinary Genius--with Wisdom, Inspiration, and Ideas from the World's Most Creative Chefs",Karen Page,9780316267809,2,0,
gid://shopify/Product/5238904094853,OP: Lucky Peach Vol 1,David Chang & Editors,LUCKY 1,0,0,
gid://shopify/Product/5238904258693,OP: Lucky Peach Vol 20,Peter Meehan and Editors,LUCKY 20,0,0,
gid://shopify/Product/5238904291461,OP: Lucky Peach Vol 24/25,Peter Meehan and Editors,LUCKY 24,0,0,
gid://shopify/Product/5238905503877,Menus: A Book for Your Meals and Memories,Jacques Pépin,9781328497666,0,0,
gid://shopify/Product/5238906781829,New Mediterranean Jewish Table,Joyce Goldstein,9780520284999,2,0,
gid://shopify/Product/5238907240581,The Nordic Cookbook,Magnus Nilsson,9780714868721,1,0,
gid://shopify/Product/5238907273349,The Nordic Kitchen: One Year of Family Cooking,Claus Meyer,9781784721626,0,0,
gid://shopify/Product/5238907928709,Opera (French),Cedric Grolet,9782379450273,0,0,
gid://shopify/Product/5238908452997,"The Pastry Chef's Little Black Book: The Definitive Recipe Collection; For Chefs, By Chefs",Michael Zebrowski & Michael Mignano,9780933477636,0,0,
gid://shopify/Product/5238908649605,Pastry Revolution 29,Montagud Editores,PASTRY 29,0,0,
gid://shopify/Product/5238908846213,Pastry Revolution 39,Montagud Editores,PASTRY 39,0,0,
gid://shopify/Product/5238908878981,Pastry Revolution 40,Montagud Editores,PASTRY 40,0,0,
gid://shopify/Product/5238909304965,Phoenix Claws and Jade Trees: Essential Techniques of Authentic Chinese Cooking,Kian Lam Kho,9780385344685,1,0,
gid://shopify/Product/5238910648453,Preserving the Japanese Way,Nancy Singleton Hachisu,9781449450885,0,0,
gid://shopify/Product/5238913433733,Sifratna: Recipes from Our Yemeni Kitchen,Amjaad Al Hussain,9780368920486,0,0,
gid://shopify/Product/5238913958021,OP: So Good #4,Vilbo,SO GO 4,0,0,
gid://shopify/Product/5238914220165,Souk: Feasting at the Mezze Table,Nadia Zeruoali & Merijn Tol,9781925418620,0,0,
gid://shopify/Product/5238914809989,Sumac #1,,SUMAC 1,0,0,
gid://shopify/Product/5238915694725,Toothache Magazine #3,Toothache Editors,TOOTH 3,1,0,
gid://shopify/Product/5238915727493,Toothache Magazine #4,Toothache Editors,TOOTH 4,0,0,
gid://shopify/Product/5238915760261,Toothache Magazine #5,Toothache Editors,TOOTH 5,0,0,
gid://shopify/Product/5238915793029,Toothache Magazine #6,Toothache Editors,TOOTH 6,0,0,
gid://shopify/Product/5238917955717,Ambrosia Vol. 6 (London),Ambrosia,AMBRO 6,0,0,
gid://shopify/Product/5238919069829,OP: Cooking With Pomiane,Edouard de Pomiane,,0,0,
gid://shopify/Product/5238919430277,OP: Desserts,Nancy Silverton,,0,0,
gid://shopify/Product/5238919561349,Dosa Kitchen: Recipes for India's Favorite Street Food,Nash Patel & Le Scheintaub,9780451499103,0,0,
gid://shopify/Product/5238921166981,How to Grill Everything,Mark Bittman,9780544790308,1,0,
gid://shopify/Product/5238921920645,Mirazur (English),Mauro Colagreco,9789876376211,0,0,
gid://shopify/Product/5238923427973,OP: So Good #11,Grupo Vilbo,SO GO 11,0,0,
gid://shopify/Product/5238923460741,OP: So Good #1,Vilbo,SO GO 1,0,0,
gid://shopify/Product/5238923493509,OP: So Good #12,Vilbo,SO GO 12,0,0,
gid://shopify/Product/5238923526277,OP: So Good #14: the Magazine of Haute Patisserie,Vilbo,SO GO 14,0,0,
