Product ID,Title,Author/SKU,ISBN/Barcode,Inventory,Unfulfilled Qty,Collections
gid://shopify/Product/5238923559045,OP: So Good #15,Vilbo,SO GO 15,0,0,
gid://shopify/Product/5238923591813,OP: So Good #17,Vilbo,SO GO 17,0,0,
gid://shopify/Product/5238923624581,So Good #18 the Magazine of Haute Patisserie,Vilbo,SO GO 18,0,0,
gid://shopify/Product/5238923657349,So Good #19: the Magazine of Haute Patisserie,Vilbo,SO GO 19,0,0,
gid://shopify/Product/5238923690117,OP: So Good #2,Vilbo,SO GO 2,0,0,
gid://shopify/Product/5238923722885,So Good #20: the Magazine of Haute Patisserie,Vilbo,SO GO 20,0,0,
gid://shopify/Product/5238923788421,So Good #22:  the Magazine of Haute Patisserie,Vilbo,SO GO 22,0,0,
gid://shopify/Product/5238923821189,So Good #23: the Magazine of Haute Patisserie,Vilbo,SO GO 23,0,0,
gid://shopify/Product/5238924542085,Table Tales: The Global Nomad Cuisine of Abu Dhabi,Hanan Sayed Worrell,9788891817938,0,0,
gid://shopify/Product/5238925525125,OP: Verdura: Vegetables Italian Style,Viana La Place,,0,0,
gid://shopify/Product/6536269561989,OP: Amarcord,Marcella Hazan,9781592403882,0,0,
gid://shopify/Product/6536272806021,OP: Art Culinaire #1,Art Culinaire,ART CU 01,0,0,
gid://shopify/Product/6536272871557,OP: Art Culinaire #34,Art Culinaire,ART CU 34,0,0,
gid://shopify/Product/6536273232005,OP: The Art of Cuisine,Henri de la Toulouse-Lautrec and Maurice Joyant,,0,0,
gid://shopify/Product/6536274083973,"OP: Artisan Baking Across America: the Breads, the Bakers, the Best Recipes",Maggie Glezer,,0,0,
gid://shopify/Product/6536278835333,OP: Belgian Chocolates,Roger Geerts,,0,0,
gid://shopify/Product/6536280440965,OP: The Big Fat Duck Cookbook,Heston Blumenthal,9781596915503,0,0,
gid://shopify/Product/6536280866949,OP: Black Pudding and Foie Gras,Andrew Pern,9780955893001,0,0,
gid://shopify/Product/6536288206981,OP: Cezanne and the Provencal Table,"Jean-Bernard Naudin, Jacqueline Saulnier, and Gilles Plazy",,0,0,
gid://shopify/Product/6536289222789,OP: Chef's Tale,Pierre Franey,,0,0,
gid://shopify/Product/6536289910917,OP: The Chicken Book,Page Smith and Charles Daniel,,0,0,
gid://shopify/Product/6536292499589,OP: Eric Briffard Le Cinq,Chihiro Masui and Richard Haughton,9782723485180,0,0,
gid://shopify/Product/6536305377413,OP: Degustez les Plantes Sauvages,François Couplan and Marc Veyrat,,0,0,
gid://shopify/Product/6536307081349,OP: Diner: The Best of Casual American Cooking,Diane Rossen Worthington,,0,0,
gid://shopify/Product/6536312324229,OP: El Celler De Can Roca: the Book (first printing),"Joan, Jordi, and Josep Roca",9788493891084,0,0,
gid://shopify/Product/6536314617989,Everyday's a Sundae,Stephen Collucci and Adrienne Gagnier,9780933477506,1,0,
gid://shopify/Product/6536320778373,Food for Thought: Philosophy and Food,Elizabeth Telfer,415133823,1,0,
gid://shopify/Product/6536321499269,OP: Food Markets of the World (signed first printing),Nelli Sheffer & Mimi Sheraton,9780810911840,0,0,
gid://shopify/Product/6536323530885,OP: Founding Farms: Portraits of Five Massachusetts Family Farms,Michael E. C. Gery,,0,0,
gid://shopify/Product/6536328347781,OP: Foods of Naples and Campania,Giuliano Bugialli,,0,0,
gid://shopify/Product/6536346894469,OP: Aquitaine: Produits du Terroir et Recettes Traditionnelles,CNAC,2226087222,0,0,
gid://shopify/Product/6536346992773,OP: Region Centre: Produits du Terroir et Recettes Traditionnelles,CNAC,L'IPC: CENTRE,0,0,
gid://shopify/Product/6536347025541,OP: Champagne Ardenne: Produits du Terroir et Recettes Traditionnelles,CNAC,2226115161,0,0,
gid://shopify/Product/6536347156613,OP: Ile-De-France: Produits du Terroir et Recettes Traditionnelles,CNAC,222606348X,0,0,
gid://shopify/Product/6536347189381,OP: Languedoc-Roussillon: Produits du Terroir et Recettes Traditionnelles,CNAC,2226099867,0,0,
gid://shopify/Product/6536347222149,OP: Limousin: Produits du Terroir et Recettes Traditionnelles,Cnac,2226096094,0,0,
gid://shopify/Product/6536347254917,OP: Lorraine: Produits du Terroir et Recettes Traditionnelles,CNAC,2226100032,0,0,
gid://shopify/Product/6536347320453,OP: Normandie: Produits du Terroir et Recettes Traditionnelles,CNAC,9782226138477,0,0,
gid://shopify/Product/6536347385989,OP: Rhones-Alpes: Produits du Terroir et Recettes Traditionnelles,CNAC,2226076352,0,0,
gid://shopify/Product/6536347549829,Laduree: Chocolate,Laduree,9782812310713,0,0,
gid://shopify/Product/6536351645829,OP: Lucky Peach Vol 16,Peter Meehan and Editors,LUCKY 16,0,0,
gid://shopify/Product/6536351678597,OP: Lucky Peach Vol 21,,LUCKY 21,0,0,
gid://shopify/Product/6536351711365,OP: Lucky Peach Vol 22,,LUCKY 22,0,0,
gid://shopify/Product/6536351744133,OP: Lucky Peach Vol 23,Peeter Meehan and David Chang,LUCKY 23,0,0,
gid://shopify/Product/6536353087621,OP: Mama Nazima's Jewish Iraqi Cuisine,Rivka Goldman,,0,0,
gid://shopify/Product/6536360427653,OP: Mrs. Wheelbarrow's Practical Pantry: Recipes and Techniques for Year-round Prese,Cathy Barrow,9780393240733,0,0,
gid://shopify/Product/6536365015173,OP: Nobody Knows the Truffles I've Seen (unsigned),George Lang,,0,0,
gid://shopify/Product/6536366096517,OP: Notebooks of Michel Bras: Desserts,Michel Bras,,0,0,
gid://shopify/Product/6536368128133,OP: Origin,Ben Shewry,9781741969870,0,0,
gid://shopify/Product/6536370094213,OP: A Passion for Potatoes,Lydie Marshall,,0,0,
gid://shopify/Product/6536372748421,OP: ph10: Patisserie Pierre Herme,Pierre Herme,9782914645720,0,0,
gid://shopify/Product/6536374124677,OP: Plant Kingdoms: the Photographs of Charles Jones,Sean Sexton and Robert Flynn Johnson,,0,0,
gid://shopify/Product/6536377630853,"OP: Provence, 1970",Luke Barr,,0,0,
gid://shopify/Product/6536381792389,OP: River Cottage Veg Everyday!,Hugh Fearnley-Whittingstall,9781408812129,0,0,
gid://shopify/Product/6536387002501,OP: Sepia,Martin Benn,9781743363522,0,0,
gid://shopify/Product/6536390279301,OP: So Good #13,Vilbo,SO GO 13,0,0,
gid://shopify/Product/6536399421573,OP: The Tenth Muse,Judith Jones,,0,0,
gid://shopify/Product/6536407351429,OP: The Way to Cook,Julia Child,9780394532646,0,0,
gid://shopify/Product/6536415346821,Bullipedia: The Origins of Cooking: Palaeolithic and Neolithic Cooking (signed copy),Ferran Adrià,9781838662387,0,0,
gid://shopify/Product/6536415379589,Cakes: 500 Piece Puzzle,,9780735366480,0,0,
gid://shopify/Product/6536415477893,Florentine: The True Cuisine of Florence (Revised),Emiko Davies,9781743796764,0,0,
gid://shopify/Product/6536415641733,Julia Child Notecards & Envelopes,,9781616899110,0,0,
gid://shopify/Product/6536416002181,The New Classics: Revised  a Definitive Collection of Classisc for Every Modern Cook,Donna Hay,9781460758359,0,0,
gid://shopify/Product/6536416067717,Noodles for Lunch: 500 Piece Puzzle,,9780735366534,0,0,
gid://shopify/Product/6536416166021,Pastry Revolution 47,Montagud Editores,PASTRY 47,0,0,
gid://shopify/Product/6536416460933,"Why We Cook; Women on Food, Identity, and Connection",Lindsay Gardner,9781523509744,0,0,
gid://shopify/Product/6536878456965,Slow Victories: A Food Lover's Guide to Slow Cookery Glory,Katrina Meynink,9781743796412,2,0,
gid://shopify/Product/6537349988485,Nixtamal: A Guide to Masa Preparation in the United States,Masienda and MiniSuper Studio,9786079760045,0,0,
gid://shopify/Product/6539983290501,OP: Art Culinaire #137,Art Culinaire,Art Cu 137,0,0,
gid://shopify/Product/6543326773381,"Hot for Food, All Day; Easy Vegan Recipes to Level Up Your Vegan Meals",Lauren Toyota,9781984857521,0,0,
gid://shopify/Product/6544517693573,Breaking the Mould,Damien Wager,9781800493599,0,0,
gid://shopify/Product/6548143505541,Global Brooklyn: Designing Food Experiences in World Cities,Fabio Parasecoli,9781350144460,1,0,
gid://shopify/Product/6551180214405,Asian Green: Everyday Plant Based Recipes inspired by the East,Ching-He Huang,9780857836342,0,0,
gid://shopify/Product/6555544420485,Paumanok Vineyards: Loaves & Fishes Farm Series Cookbook,Sybille van Kempen with Licia Kassim Householder,9781734730098,4,0,
gid://shopify/Product/6555550253189,Satur Farms: Loaves & Fishes Farm Series Cookbook,Sybille van Kempen with Licia Kassim Householder,9781736213711,1,0,
gid://shopify/Product/6564762419333,Nez #4: Perfume and Art,,9782370630599,0,0,
gid://shopify/Product/6564762615941,Nez #6: Mind & Body,,9782370630711,1,0,
gid://shopify/Product/6565660721285,"The Culinary Plagiarist: Misadventures of a Lusty, Thieving, God-fearing Gourmand",Jason Peters,9781532689802,1,0,
gid://shopify/Product/6570354376837,Crying in H Mart: A Memoir (hardcover),Michelle Zauner,9780525657743,0,0,
gid://shopify/Product/6571277648005,Emotional Delicacies,Bobby Cortez,9781647135577,0,0,
gid://shopify/Product/6573032734853,OP: Art Culinaire #138,Art Culinaire,Art Cu 138,0,0,
gid://shopify/Product/6573197066373,My Place at the Table: A Recipe for a Delicious Life in Paris,Alexander Lobrano,9781328588838,2,0,
gid://shopify/Product/6579147702405,An Illustrated Catalog of American Fruits & Nuts,The U.S. Department of Agriculture Pomological Watercolor Collection,9781733622042,0,0,
gid://shopify/Product/6581712322693,We Are What We Eat: A Slow Food Manifesto (hardcover),Alice Waters with Bob Carrau and Cristina Mueller,9780525561538,0,0,
gid://shopify/Product/6582957047941,Kiin: Recipes and Stories From Northern Thailand,Nuit Regular,9780735236417,0,0,
gid://shopify/Product/6589468967045,Kitchen Arts & Letters Gift Card,,,0,0,
gid://shopify/Product/6589889380485,OP: In the Kitchen with Alain Passard,Christophe Blain,,0,0,
gid://shopify/Product/6589890887813,OP: Le Gout du Pain,Raymond Calvel,,0,0,
gid://shopify/Product/6590713462917,OP: Classic and Contemporary Recipes of Yves Thuriès (3 Vols),Yves Thuriès,,0,0,
gid://shopify/Product/6590713954437,OP: Maori Food and Cookery,David Fuller,,0,0,
gid://shopify/Product/6590714478725,OP: Life and Food in the Caribbean,Cristine Mackie,,0,0,
gid://shopify/Product/6590717591685,OP: Recipes From Paradise,Fred Plotkin,,0,0,
gid://shopify/Product/6590717886597,OP: The Post-Telegram Cook Book,Harriet Morgan Mead,,0,0,
gid://shopify/Product/6590721261701,OP: The Supper of the Lamb,Robert Farrar Capon,,0,0,
gid://shopify/Product/6590721392773,OP: New Salads,Mrs. S. T. Rorer,,0,0,
gid://shopify/Product/6590721884293,"OP: Favorite Island Cookery, Books I-III",Honpa Hongwanji Buddhist Temple,,0,0,
gid://shopify/Product/6590721982597,OP: Babylonian Cuisine,Julia Najor,,0,0,
gid://shopify/Product/6590722113669,OP: Rangoon International Cook Book,Woman’s Society of Christian Service of the Methodist English Church,,0,0,
gid://shopify/Product/6590722769029,OP: The Old-Time Saloon,George Ade,,0,0,
gid://shopify/Product/6590723784837,OP: La Cuisine: Simple et Facile,Tante Melanie,,0,0,
gid://shopify/Product/6590724702341,OP: A Little Bit of Butter,"Peter Foynes, editor",,0,0,
gid://shopify/Product/6590725193861,OP: The Fine Art of Mixing Drinks,David A. Embury,,0,0,
gid://shopify/Product/6590726799493,OP: A Kipper With My Tea,Alan Davidson,,0,0,
gid://shopify/Product/6590729748613,OP: The Country Kitchen and Home Grown (2 vols),Della Lutes,,0,0,
gid://shopify/Product/6590729781381,OP: The Artful Eater (hardcover),Edward Behr,,0,0,
gid://shopify/Product/6590730240133,OP: Hotel Monthly Handbooks (6 Vols),Hotel Monthly Press,,0,0,
gid://shopify/Product/6590730272901,OP: A Treasury of Great Recipes,Mary and Vincent Price,,0,0,
gid://shopify/Product/6592996900997,Edible Flowers 1000 Piece Puzzle,Olga Akbarova,9780735369078,4,0,
gid://shopify/Product/6592997195909,Heirloom Pumpkins 1000 Piece Puzzle,Christine Chitnis,9780735369559,0,0,
gid://shopify/Product/6593299972229,OP: What to Have for Luncheon,Mary J. Lincoln,,0,0,
gid://shopify/Product/6593300267141,"OP: Bons Vieux Plats du Tricastin, Les",Rodolphe Bringer,,0,0,
gid://shopify/Product/6593300562053,OP: Presbyterian Cook Book,Ladies of the First Presbyterian Church,,0,0,
gid://shopify/Product/6593300725893,"OP: Columbian Recipes, The",Ladies of the Main Street M.E. Church,,0,0,
gid://shopify/Product/6593300824197,"OP: Salads, Sandwiches, and Chafing Dish Recipes",Marion Harris Neil,,0,0,
gid://shopify/Product/6593301053573,"OP: Anatomy of Dessert, The",Edward A. Bunyard,,0,0,
gid://shopify/Product/6593301315717,OP: Vintage Ad: Kool-Aid…5¢ package makes two quarts,"1954, unidentified magazine",,0,0,
gid://shopify/Product/6593301577861,"OP: Mrs. Ellis’s Complete Cook, or Perfect Instructor",Mrs. [Sara] Ellis,,0,0,
gid://shopify/Product/6593301971077,OP: Love in the Afternoon Cookbook,Jeanne Jones,,0,0,
gid://shopify/Product/6593302102149,OP: Twentieth Century Cook Book,Twentieth Century Club,,0,0,
gid://shopify/Product/6593302200453,OP: Las Primeras Palabras de Cocina,Andoni Luis Aduriz,,0,0,
gid://shopify/Product/6593302364293,"OP: Bestiarium Gastronomicae, Signed Copy",Gyula Madarasz and Andoni Luis Aduriz,,0,0,
gid://shopify/Product/6594769485957,Taste Makers: Seven Immigrant Women Who Revolutionized Food in America (hardcover),Mayukh Sen,9781324004516,1,0,
gid://shopify/Product/6594783117445,The Kitchen Whisperers : Cooking with the Wisdom of Our Friends (hardcover),Dorothy Kalins,9780063001640,0,0,
gid://shopify/Product/6598876004485,The Latin American Cookbook (signed copy),Virgilio Martinez,9781838663858,0,0,
gid://shopify/Product/6598887637125,Slippurinn: Recipes and Stories from Iceland (signed edition),Gísli Matt,9781838663551,0,0,
gid://shopify/Product/6598890324101,Bullipedia: Unelaborated Products: Definition and Classification (signed copy),Ferran Adrià & the elBulli Foundation,9781838663834,0,0,
gid://shopify/Product/6599143784581,Matzoh Ball Gumbo: Culinary Tales of the Jewish South (Hardcover),Marcie Cohen Ferris,9780807829783,0,0,
gid://shopify/Product/6604332073093,La Vita è Dolce : Italian–Inspired Desserts,Letitia Clark,9781784884222,3,0,
gid://shopify/Product/6605904871557,OP: The Bel Canto Cookbook,Peter Gravina,,0,0,
gid://shopify/Product/6605905461381,OP: The Cafe des Artistes Cookbook,George Lang,,0,0,
gid://shopify/Product/6605906018437,OP: The Gourmet Chinese Regional Cookbook,Calvin and Audrey Lee,,0,0,
gid://shopify/Product/6605913325701,OP: La Veritable Cuisine de Famille,Tante Marie,,0,0,
gid://shopify/Product/6605913587845,OP: Weight Watchers Cook Book,Jean Nidetch,,0,0,
gid://shopify/Product/6605913620613,OP: Les Lions a Table,"Georges W. Roucayrol, ed",,0,0,
gid://shopify/Product/6605932593285,OP: The Literary Gourmet,"Linda Wolfe, editor",,0,0,
gid://shopify/Product/6609234821253,The 100 Most Jewish Foods: 500-Piece Circular Puzzle,Tablet,9781648290756,3,0,
gid://shopify/Product/6609983176837,Odd Apples: Limited Edition,William Mullan,9783775751155,0,0,
gid://shopify/Product/6610466898053,OP: Bon Appetit,Griffith Music Foundation,,0,0,
gid://shopify/Product/6610467684485,OP: The I Hate to Cook Book,Peg Bracken,,0,0,
gid://shopify/Product/6610468012165,OP: Modern Priscilla Cook Book,Priscilla Publishing Company,,0,0,
gid://shopify/Product/6610468798597,OP: Mary Frances Cook Book,Jane Eayre Fryer,,0,0,
gid://shopify/Product/6610469060741,OP: British Country Cheeses,Pamela Westland,,0,0,
gid://shopify/Product/6610469847173,OP: The Savoy of London,Compton Mackenzie,,0,0,
gid://shopify/Product/6610470142085,OP: A Cookbook for Booksellers (signed copy),"Craig Claiborne, ed.",,0,0,
gid://shopify/Product/6610470535301,OP: A Cookbook for Booksellers,"Craig Claiborne, ed.",,0,0,
gid://shopify/Product/6610471059589,OP: Paul Richards' Pastry Book,Paul Richards,,0,0,
gid://shopify/Product/6611711819909,"Truffle Hound: On the Trail of the World’s Most Seductive Scent, with Dreamers, Schemers, and Some Extraordinary Dogs (hardcover)",Rowan Jacobsen,9781635575194,0,0,
gid://shopify/Product/6615348347013,"Bayrut, The Cookbook: Recipes From the Heart of a Lebanese City Kitchen (first edition)",Hisham Assaad,9781925811698,0,0,
gid://shopify/Product/6615508353157,Clean Out Sale Early Admission,,,0,0,
gid://shopify/Product/6617536069765,The Kitchen Studio: Culinary Creations by Artists,"Phaidon Editors, Massimo Bottura",9781838663315,0,0,
gid://shopify/Product/6621470064773,OP: The Mushroom Feast,Jane Grigson,,0,0,
gid://shopify/Product/6621472653445,OP: The Esquire Culinary Companion,"Charles H. Baker, Jr.",,0,0,
gid://shopify/Product/6621596254341,OP: First Editions of Maida Heatter's First Three Books,Maida Heatter,,0,0,
gid://shopify/Product/6621609066629,OP: Eight Single Subject Pamphlets by John Thorne,John Thorne,,0,0,
gid://shopify/Product/6622783471749,World Atlas of Beer: The Essential Guide to the Beers of the World (third edition),Tim Webb and Stephen Beaumont,9781784726270,0,0,
gid://shopify/Product/6622783701125,Ramsay in 10: Delicious Recipes Made in a Flash,Gordon Ramsay,9781538707814,0,0,
gid://shopify/Product/6623783420037,OP: Au Pied du Cochon: The Album,Martin Picard,,0,0,
gid://shopify/Product/6623790006405,OP: Desserts by Pierre Herme,Dorie Greenspan,,0,0,
gid://shopify/Product/6623792693381,OP: Celebrar el Milenio con Arzak & Adria,Ferran Adrià and Juan Mari Arzak,,0,0,
gid://shopify/Product/6624837632133,Cosmic Fruits Scratch and Sniff Puzzle,Mudpuppy & Illustrated by Rob Hodgson,9780735370135,0,0,
gid://shopify/Product/6626862268549,La France des Patisseries,Francois Blanc,9782379450778,0,0,
gid://shopify/Product/6627556950149,OP: Nobody Knows the Truffles I've Seen (signed),George Lang,,0,0,
gid://shopify/Product/6627557048453,OP: A Year in Chocolate,Alice Medrich,,0,0,
gid://shopify/Product/6627557376133,OP: Jerusalem (signed),Yotam Ottolenghi and Sami Tammimi,,0,0,
gid://shopify/Product/6627557867653,OP: Papiers d'Orange,Pascal Pierrey,,0,0,
gid://shopify/Product/6627557965957,OP: Kitchen Fun,Louise Price Bell,,0,0,
gid://shopify/Product/6627558228101,OP: Book of Tarts,Maury Rubin,,0,0,
gid://shopify/Product/6627558686853,OP: Visions of Sugarplums,Mimi Sheraton,,0,0,
gid://shopify/Product/6627558916229,OP: Entertaining,Martha Stewart,,0,0,
gid://shopify/Product/6627603447941,OP: Madame Maigret's Recipes,Robert J. Courtine,,0,0,
gid://shopify/Product/6628131405957,Tratado de Panaderia de Masa Madre,Thomas Teffri-Chambelland,9782957261161,2,0,
gid://shopify/Product/6631143047301,OP: The French Cook or The Art of Cooking,Louis Eustache Ude,,0,0,
gid://shopify/Product/6631157203077,OP: The French Cook or The Art of Cooking (1978),Louis Eustache Ude,,0,0,
gid://shopify/Product/6631158972549,OP: Gathering What the Great Nature Provided,The people of ‘Ksan,,0,0,
gid://shopify/Product/6631159922821,OP: Le Grand Dictionnaire de Cuisine,Alexandre Dumas,,0,0,
gid://shopify/Product/6631163199621,OP: Le Cuisinier Parisien,B. Albert,,0,0,
gid://shopify/Product/6639773483141,Cherry Bombe 18 Natasha,Cherry Bombe,CHERRY 18 NAT,0,0,
gid://shopify/Product/6639773778053,Cherry Bombe 18 Zoe,Cherry Bombe,CHERRY 18 ZOE,0,0,
gid://shopify/Product/6639900885125,OP: Maida Heatter's Book of Great American Desserts,Maida Heatter,,0,0,
gid://shopify/Product/6641097506949,Ukrainian Cuisine in 70 Dishes,Ievgen Klopotenko,9786177820856,0,0,
gid://shopify/Product/6644304412805,Fleurs (French language edition),Cedric Grolet,9782379450811,0,0,
gid://shopify/Product/6644313915525,A la Table des Tsars: la Fabuleuse Ascension de Pierre Cubat a la Cour des Empereurs Russes,Nicolas de Breteche,9782374370569,0,0,
gid://shopify/Product/6645934489733,Bullipedia: Italian Breakfast (signed copy),Ferran Adrià and the elBulli Foundation,9781838665159,0,0,
gid://shopify/Product/6652443328645,OP: The Nero Wolfe Cookbook,Rex Stout,,0,0,
gid://shopify/Product/6652656779397,OP: Culinary Chronicle Volumes 1-8,Opt Art,,0,0,
gid://shopify/Product/6652656910469,"OP: Culinary Chronicle Volume 1: Hong Kong, Morocco/Marokko, and London",Opt Art,CULCHR1,0,0,
gid://shopify/Product/6652657008773,OP: Culinary Chronicle Volume 2: Italy and California,Opt Art,CULCHR2,0,0,
gid://shopify/Product/6652657205381,OP: Culinary Chronicle Volume 3: New York and Paris,Opt Art,CULCHR3,0,0,
gid://shopify/Product/6652658090117,OP: Culinary Chronicle Volume 4: Spain and Southeast Asia,Opt Art,CULCHR4,0,0,
gid://shopify/Product/6652659204229,OP: Culinary Chronicle Volume 5: South and South Eastern France,Opt Art,CULCHR5,0,0,
gid://shopify/Product/6652660088965,OP: Culinary Chronicle Volume 6: Germany and Switzerland,Opt Art,CULCHR6,0,0,
gid://shopify/Product/6652661760133,OP: Culinary Chronicle Volume 8:  Tokyo and Europe,Opt Art,CULCHR8,0,0,
gid://shopify/Product/6653048193157,Everyday Entertaining: 110+ Recipes for Going All Out When You're Staying In,Elizabeth Van Lierde,9781681885889,0,0,
gid://shopify/Product/6653812605061,Eating to Extinction : The World's Rarest Foods and Why We Need to Save Them,Dan Saladino,9780374605322,0,0,
gid://shopify/Product/6654861410437,Carving Kitchen Tools,Moa Brännström Ott,9781911663713,0,0,
gid://shopify/Product/6658071232645,OP: Cooking with Josephine,Joesphine Araldo,0385276168,0,0,
gid://shopify/Product/6658095218821,White Rabbit: Recipes & Stories from Russia,Vladimir Mukhin,9781838663902,0,0,
gid://shopify/Product/6658119925893,OP: Culinary Chronicle Volume 9:  Hungary (Very Limited Edition),Opt Art,CULCHR9LE,0,0,
gid://shopify/Product/6658762211461,Stay Me With Flagons: A Book About Wine and Other Things,Maurice Healy,9781913141233,0,0,
gid://shopify/Product/6659012853893,Salad: 100 Recipes for Simple Salads & Dressings,Janneke Philippi,9781922417619,0,0,
gid://shopify/Product/6659344466053,Bachour in Color,Antonio Bachour,9788896027455,0,0,
gid://shopify/Product/6659991634053,Tamu: A Guest at the Bornean Table,Bryan Koh,9789811804809,2,0,
gid://shopify/Product/6661511348357,Art of the Cheeseboard 1000 Piece Multi-Puzzle Puzzle,Julie Seabrook Ream (Photographer),9780735372726,0,0,
gid://shopify/Product/6662107234437,Karavan Kitchen,Soraya Beheshti,9781590566008,1,0,
gid://shopify/Product/6662451101829,The Secret Life of Groceries: The Dark Miracle of the American Supermarket (paperback),Benjamin Lorr,9780553459418,2,0,
gid://shopify/Product/6663169540229,Petit Fours: Bocados dulces para culminar un menú,Saber y Sabor,Saber y Sabor 186,0,0,
gid://shopify/Product/6663170293893,Arte Heladero #203,Arte Helado,Helado 203,4,0,
gid://shopify/Product/6663170392197,Arte Heladero #204,Arte Helado,Helado 204,5,0,
gid://shopify/Product/6663171833989,Arte Heladero #205,Arte Heladero,Heladero 204,3,0,
gid://shopify/Product/6663357792389,Date & Chami,Maryam Mubarak,9781989875193,3,0,
gid://shopify/Product/6664406335621,OP: The Magic of Fire,William Rubel,,0,0,
gid://shopify/Product/6664407744645,OP: Party Spirit,Robert Farrar Capon,,0,0,
gid://shopify/Product/6664407974021,OP: Food,Ogden Nash,,0,0,
gid://shopify/Product/6665037840517,"Terrinas, Rillettes, Salchichas y Pâtés en Croûte",Gilles & Nicolas Verot,9788408248392,0,0,
gid://shopify/Product/6667557011589,OP: Straight Up or On the Rocks,William Grimes,,0,0,
gid://shopify/Product/6667559108741,OP: Punch: A Voyage of Discovery,Dave Wondrich and Jim Meehan,,0,0,
gid://shopify/Product/6667559272581,OP: Stirred—Not Shaken,John Doxat,,0,0,
gid://shopify/Product/6667559338117,OP: Trader Vic's Bartender's Guide (revised),"""Trader Vic"" Bergeron",,0,0,
gid://shopify/Product/6667559469189,"OP: Mesdames, Messieurs",Paul Reboux,,0,0,
gid://shopify/Product/6667559534725,OP: Bottoms Up!,"Clifford Leach, editor",,0,0,
gid://shopify/Product/6667559731333,OP: Burke's Complete Cocktail and Drinking Recipes,Harman Burney Burke,,0,0,
gid://shopify/Product/6667561304197,OP: Notes on a Cellar-Book,George Saintsbury,,0,0,
gid://shopify/Product/6667562680453,OP: Bartender's Guide to the Best Mixed Drinks,"""Kappa""",,0,0,
gid://shopify/Product/6667562909829,OP: Lafite,Cyril Ray,,0,0,
gid://shopify/Product/6670224621701,Tokyo Up Late: Iconic Recipes from the City That Never Sleeps,Brendan Liew,9781922417596,0,0,
gid://shopify/Product/6670337212549,At the Farmer's Market 1000 Piece Puzzle,Whooli Chen,9781648961359,0,0,
gid://shopify/Product/6671603630213,OP: Cooking with Herbs and Spices,Craig Claiborne,,0,0,
gid://shopify/Product/6671603761285,OP: The New York Times Menu Cook Book,Craig Claiborne,,0,0,
gid://shopify/Product/6671604285573,OP: Craig Claiborne's Kitchen Primer,Craig Claiborne,,0,0,
gid://shopify/Product/6671604449413,OP: The New York Times International Cook Book,Craig Claiborne,,0,0,
gid://shopify/Product/6671604514949,OP: Craig Claiborne's Favorites from The New York Times Vols. I-IV,Craig Claiborne,,0,0,
gid://shopify/Product/6671604646021,"OP: Veal Cookery (signed, first printing)",Craig Claiborne and Pierre Franey,,0,0,
gid://shopify/Product/6671604809861,OP: Veal Cookery,Craig Claiborne and Pierre Franey,,0,0,
gid://shopify/Product/6671605334149,OP: Craig Claiborne's Gourmet Diet,Craig Claiborne with Pierre Franey,,0,0,
gid://shopify/Product/6671605629061,OP: A Feast Made for Laughter,Craig Claiborne,,0,0,
gid://shopify/Product/6671606415493,OP: A Feast Made for Laugher (paperback),Craig Claiborne,,0,0,
gid://shopify/Product/6671606710405,OP: The Master Cooking Course,Craig Claiborne and Pierre Franey,,0,0,
gid://shopify/Product/6671607038085,OP: Cooking with Craig Claiborne and Pierre Franey,Craig Claiborne and Pierre Franey,,0,0,
gid://shopify/Product/6671607201925,OP: The New York Times Food Encyclopedia,Craig Claiborne,,0,0,
gid://shopify/Product/6671607300229,OP: Craig Claiborne's Memorable Meals,Craig Claiborne,,0,0,
gid://shopify/Product/6671607398533,OP: Craig Claiborne's Southern Cooking,Craig Claiborne,,0,0,
gid://shopify/Product/6683436810373,OP: Nuevo Latino,Douglas Rodriguez,,0,0,
gid://shopify/Product/6683440513157,OP: Cocina Chilena,Monica Pardo Blum,,0,0,
gid://shopify/Product/6683441201285,OP: Dictionary of Italian Cuisine,Maureen B. Fant and Howard M. Isaacs,,0,0,
