Product ID,Title,Author/SKU,ISBN/Barcode,Inventory,Unfulfilled Qty,Collections
gid://shopify/Product/6896126165125,Summer 2024 Cookbook Club,,,0,0,
gid://shopify/Product/6896127475845,Cookbook Club: The Zuni Cafe Cookbook,Cookbook Club Winter 2024 March,,0,0,
gid://shopify/Product/6896128327813,Cookbook Club: Arabesque,Cookbook Club Spring 2024 May,,0,0,
gid://shopify/Product/6896128721029,Cookbook Club: The Last Course,Cookbook Club Spring 2024 June,,0,0,
gid://shopify/Product/6896330047621,Cookbook Club: Salad Freak,Cookbook Club Summer 2024 July,,0,0,
gid://shopify/Product/6896333029509,Cookbook Club: The Upstairs Delicatessen,Cookbook Club Summer 2024 August,,0,0,
gid://shopify/Product/6896334078085,Cookbook Club: Heart of the Artichoke,Cookbook Club Summer 2024 September,,0,0,
gid://shopify/Product/6902002417797,OP: Abruzzo in Bocca (Gulliver edition),Edizione Gulliver,,0,0,
gid://shopify/Product/6902007988357,OP: Friuli in Bocca (Gulliver edition),Edizione Gulliver,,0,0,
gid://shopify/Product/6902012805253,OP: Lazio in Bocca (Gulliver edtition),Edizione Gulliver,,0,0,
gid://shopify/Product/6902020669573,OP: Liguria in Bocca (LNE edtition),La Nuova Edrisi,,0,0,
gid://shopify/Product/6902025912453,OP: Lombardia in Bocca (Gulliver edition),Edizione Gulliver,,0,0,
gid://shopify/Product/6902031548549,OP: Marche in Bocca (Gulliver edition),Edizione Gulliver,,0,0,
gid://shopify/Product/6902037577861,OP: Napoli in Bocca (Edikronos edition),Edikronos,,0,0,
gid://shopify/Product/6902042132613,OP: Piemonte in Bocca (Gulliver edition),Edizione Gulliver,,0,0,
gid://shopify/Product/6902045704325,OP: Puglie in Bocca (Gulliver edition),Edizione Gulliver,,0,0,
gid://shopify/Product/6902049407109,OP: Romagna in Bocca (Gulliver edition),Edizione Gulliver,,0,0,
gid://shopify/Product/6902053044357,OP: Sardegna in Bocca (Gulliver edition),Edizione Gulliver,,0,0,
gid://shopify/Product/6902062121093,OP: Toscana in Bocca (LNE edition),LNE,,0,0,
gid://shopify/Product/6902067134597,OP: Trentino in Bocca (Gulliver edition),Edizione Gulliver,,0,0,
gid://shopify/Product/6902071361669,OP: Umbria in Bocca (Gulliver edition),Edizione Gulliver,,0,0,
gid://shopify/Product/6902076539013,OP: Val d'Aosta in Bocca (Gulliver edtion),Edizione Gulliver,,0,0,
gid://shopify/Product/6906324516997,Talk & Taste: Kung Food with Jon Kung,Event at Essex Market-1,,0,0,
gid://shopify/Product/6907743928453,Cookbook Club: Chef's Kitchen Supplement,,,6,0,
gid://shopify/Product/6913083703429,OP: Culinary Classics and Improvisations,Michael Field,,0,0,
gid://shopify/Product/6913084129413,OP: Among Friends,M.F.K. Fisher,,0,0,
gid://shopify/Product/6913084391557,OP: Vegetarian Epicure,Anna Thomas,,0,0,
gid://shopify/Product/6913086292101,OP: A Book of Middle Eastern Food,Claudia Roden,,0,0,
gid://shopify/Product/6913088192645,OP: Beard on Bread,James Beard,,0,0,
gid://shopify/Product/6913088618629,OP: The Taste of Country Cooking,Edna Lewis,,0,0,
gid://shopify/Product/6913088749701,OP: The Fannie Farmer Cookbook,"Marion Cunningham, Fannie Merritt Farmer",,0,0,
gid://shopify/Product/6913089044613,OP: Nela's Cookbook,Nela Rubinstein,,0,0,
gid://shopify/Product/6913119191173,OP: The Key to Chinese Cooking,Irene Kuo,,0,0,
gid://shopify/Product/6913120993413,OP: The Classic Italian Cookbook and More Classic Italian Cooking (2 vols),Marcella Hazan,,0,0,
gid://shopify/Product/6916247715973,At the Table in Paris: Recipes from the Best Cafés and Bistros,Jan Thorbecke Verlag,9781784886912,0,0,
gid://shopify/Product/6922652123269,OP: North Atlantic Seafood,Alan Davidson,,0,0,
gid://shopify/Product/6922689380485,OP: Great Chefs of France,Anthony Blake and Quentin Crewe,,0,0,
gid://shopify/Product/6922692558981,OP: Home Economics,Maria Parloa,,0,0,
gid://shopify/Product/6922693476485,OP: Intoxication Made Easy,Elliot Paul and Luis Quintanilla,,0,0,
gid://shopify/Product/6922693804165,OP: The Grocer's Encyclopedia,Artemas Ward,,0,0,
gid://shopify/Product/6922695278725,OP: Hotel Meat Cooking,Jessup Whitehead,,0,0,
gid://shopify/Product/6922696556677,OP: Pleasant Journeys and Good Eats Along the Way,"Jay Williams, editor",,0,0,
gid://shopify/Product/6923252236421,"Sesame, Soy, Spice Talk with Remy Morimoto Park",,,0,0,
gid://shopify/Product/6934158049413,René Redzepi Book Signing | Meet and Greet,Event 20240414,,0,0,
gid://shopify/Product/6935405363333,"A Bold Return to Giving a Damn: One Farm, Six Generations, and the Future of Food",Will Harris,9780593300473,0,0,
gid://shopify/Product/6952404648069,OP: La Cuisinière de la Campagne et de la Ville,Louis-Eustache Audot,,0,0,
gid://shopify/Product/6952411725957,OP: La Cuisine et la Patisserie Expliquees du Cordon-Bleu,Bibliothèque du Journal Le Cordon-Bleu,,0,0,
gid://shopify/Product/6952414707845,OP: Le Grand Livre de Cuisine,Prosper Montagné and Prosper Salles,,0,0,
gid://shopify/Product/6952417984645,OP: Les Menus Détaillés de la Ménagère,Henri-Paul Pellaprat,,0,0,
gid://shopify/Product/6952419295365,OP: Les Menus Détaillés de la Ménagère,Henri-Paul Pellaprat,,0,0,
gid://shopify/Product/6952426930309,OP: Le Livre de Recettes d’un Compagnon du Tour de France (6 vols),Yves Thuriès,,0,0,
gid://shopify/Product/6964120780933,Door73,Marcello Ballardin and Eric Ivanidis,9789401496254,2,0,
gid://shopify/Product/6977984266373,Talk & Taste: Keep It Zesty with Edy Massih,Massih Admission Only,,0,0,
gid://shopify/Product/6977989378181,Elle Simone Scott at Essex Market with Anicia Ngozi,Simone Admission Only,,0,0,
gid://shopify/Product/6978879422597,Talk & Taste: Nom Wah with Wilson Tang and Joshua David Stein,Tang Admission,,0,0,
gid://shopify/Product/6980559962245,OP: Frigidaire Recipes,The Frigidaire Corporation,,0,0,
gid://shopify/Product/6983075856517,OP: Heinz Book of Salads,H. J. Heinz Co.,,0,0,
gid://shopify/Product/6983078805637,OP: Dried Fruits,"The Atchison, Topeka & Santa Fe Railway Co.",,0,0,
gid://shopify/Product/6983079493765,OP: 500 Tasty Sandwiches,"Ruth Berolzheimer, editor",,0,0,
gid://shopify/Product/6983080870021,OP: The Sportsman's Way: How to Prepare Wild Game and Waterfowl,Frederic H. Grinau Creations,,0,0,
gid://shopify/Product/6983084343429,OP: 101 Ways to Prepare Macaroni,"V. La Rosa & Sons, Inc.",,0,0,
gid://shopify/Product/6983087554693,"OP: CBS Homemakers Exchange Recipes, Volume 4",Harvey and Howe Productions,,0,0,
gid://shopify/Product/6983089094789,OP: How to Be a Cake Genius with Your Sunbeam Mixmaster,General Foods Corp.,,0,0,
gid://shopify/Product/6983091224709,OP: The Modern Bartenders' and Hosts' Guide to Cocktails,Mr. Bib The Mythical Gourmet,,0,0,
gid://shopify/Product/6983093092485,OP: Wick and Lick,Ruth Chier Rosen,,0,0,
gid://shopify/Product/6983097319557,OP: Betty Crocker's Bisquick Cook Book,"General Mills, Inc.",,0,0,
gid://shopify/Product/6983098892421,OP: Chiquita Banana Recipe Book,United Fruit Company,,0,0,
gid://shopify/Product/6983104462981,OP: A Feast of Yuletide Cookies,"Tested Recipe Institute, Inc.",,0,0,
gid://shopify/Product/6983107346565,OP: Let's Eat Eggs,Gertrude Armbruster,,0,0,
gid://shopify/Product/6983108034693,OP: You're Really Cooking When You're Cooking with Seven-Up!,Seven-Up Co.,,0,0,
gid://shopify/Product/6983109247109,OP: How to Make 32 After-Sports Drinks,Southern Comfort Corporation,,0,0,
gid://shopify/Product/6983110000773,OP: Spin Cookery: Osterizer Blender Cookbook,John Oster Manufacturing Co.,,0,0,
gid://shopify/Product/6983110754437,OP: The Bacardi Party Book,"Bacardi Imports, Inc.",,0,0,
gid://shopify/Product/6983111180421,OP: Spice Islands Cook's Survival Cookbook,Specialty Brands Incorporated,,0,0,
gid://shopify/Product/6983111508101,OP: Corn Products Cook Book,Emma Churchman Hewitt,,0,0,
gid://shopify/Product/6983112392837,OP: Four Pamphlets from United Dairy Industry Association and American Dairy Association,United Dairy Industry Association and American Dairy Association,,0,0,
gid://shopify/Product/6983112884357,OP: Vernors Recipes,Powell Associates,,0,0,
gid://shopify/Product/6983113244805,OP: 100 Delicious Recipes Made with Marshmallow Fluff,"Durkee-Mower, Inc.",,0,0,
gid://shopify/Product/6983113801861,OP: Recipes and Instructions for Your Grant Maid Automatic Electric Fryer Cooker,W. T. Grant Co.,,0,0,
gid://shopify/Product/6992931094661,Taste Buds: A Field Guide to Cooking and Baking with Flowers,Nikki Fotheringham,9780525612193,0,0,
gid://shopify/Product/6997352808581,OP: The Supper of the Lamb,Robert Farrar Capon,,0,0,
gid://shopify/Product/6997484077189,OP: Hungarian Cookery,[anonymous],,0,0,
gid://shopify/Product/6997493055621,OP: The Ballet Cook Book (signed),Tanaquil Le Clercq,,0,0,
gid://shopify/Product/6997494530181,OP: The Ballet Cook Book,Tanaquil Le Clercq,,0,0,
gid://shopify/Product/6997496234117,OP: La Cuisiniere Bourgeoise,[Menon],,0,0,
gid://shopify/Product/6997497741445,OP: Modern Culinary Art,Henri-Paul Pellaprat,,0,0,
gid://shopify/Product/6997507047557,OP: L'Art Culinaire a Travers l'Algerie,Z. Sekelli,,0,0,
gid://shopify/Product/6997511045253,OP: Casserole Cookery,Marian and Nino Tracy,,0,0,
gid://shopify/Product/7007201624197,Amrikan with Khushbu Shah and Deb Perelman,,,0,0,
gid://shopify/Product/7008041697413,OP: The Tenth Muse,Judith Jones,,0,0,
gid://shopify/Product/7009878638725,Talk & Taste: Dessertpalooza at Essex Market with Priya Krishna and Christina Tosi!,,,0,0,
gid://shopify/Product/7013821481093,Moonshine: A Life in Pursuit of White Liquor,Alec Wilkinson,9781567928051,1,0,
gid://shopify/Product/7020037472389,Talk & Taste: Italian American with Angie Rito and Scott Tacinelli,,,0,0,
gid://shopify/Product/7022034911365,"Wander, Eat, and Tell Walking Tour of the Lower East Side","Annette Tomei of Wander, Eat & Tell",,11,0,
gid://shopify/Product/7023439020165,OP: The Vegetarian Epicure (signed paperback),Anna Thomas,,0,0,
gid://shopify/Product/7023439478917,OP: Whole Earth Cook Book,Sharon Cadwallader and Judi Ohr,,0,0,
gid://shopify/Product/7023440265349,OP: The Political Palate,The Bloodroot Collective,,0,0,
gid://shopify/Product/7023445573765,OP: Recipes for a Small Planet,Ellen Buchman Ewald,,0,0,
gid://shopify/Product/7023446884485,OP: Cosmic Cookery,Kathryn Hannaford,,0,0,
gid://shopify/Product/7035548237957,OP: Ma Cuisine du Soleil,Roger Verge,,0,0,
gid://shopify/Product/7035560493189,OP: La Cocina de los Valientes,Pau Arenós,,0,0,
gid://shopify/Product/7035576680581,OP: In de Wulf,Kobe Desramaults,,0,0,
gid://shopify/Product/7035580907653,OP: Encyclopédie Culinaire du XXIe Siècle,Marc Veyrat,,0,0,
gid://shopify/Product/7036581478533,OP: Emilia in Bocca (Edizione e Ristampe Siciliane edition),Edizione e Ristampe Siciliane,,0,0,
gid://shopify/Product/7036581806213,OP: Milano in Bocca (Edikronos edition),Edikronos,,0,0,
gid://shopify/Product/7038530584709,OP: The Oysters of Locmariaquer,Eleanor Clark,,0,0,
gid://shopify/Product/7038534353029,OP: Last House,M.F.K. Fisher,,0,0,
gid://shopify/Product/7038545625221,OP: Grandmother's Cooky Jar,Helen Fuller Orton,,0,0,
gid://shopify/Product/7039906939013,Kowbird,Matt Horn,9780760387412,1,0,
gid://shopify/Product/7041044447365,Talk & Taste: Bright Cooking with Camille Becerra,,,0,0,
gid://shopify/Product/7041418199173,Cookbook Club Tasting: Spice: A Cook’s Companion by Mark Diacono,,,0,0,
gid://shopify/Product/7041821376645,Old TIme Hawkey's: Recipes from the Cedar Swamp,Old Time Hawkey,9780744093902,0,0,
gid://shopify/Product/7045959876741,Fall 2024 Cookbook Club,,,0,0,
gid://shopify/Product/7045960171653,Cookbook Club: Grains for Every Season,,,0,0,
gid://shopify/Product/7045963677829,Cookbook Club: All About Roasting,,,0,0,
gid://shopify/Product/7045991465093,"Cookbook Club: Roast Figs, Sugar Snow",,,0,0,
gid://shopify/Product/7050050371717,OP: Two Volumes on Betel Chewing,"Harry Beran, Dawn F. Rooney",,0,0,
gid://shopify/Product/7050051190917,"OP: Herbs, Salads and Seasonings",X. Marcel Boulestin,,0,0,
gid://shopify/Product/7050052272261,OP: Nur Knodel,Franziska Helmreich and Anton Staudinger,,0,0,
gid://shopify/Product/7050053517445,OP: Empanadas and Other International Turnovers,George and Sherry LaFollette Zabriskie,,0,0,
gid://shopify/Product/7050054467717,OP: Capsicum y Cultura,Janet Long-Solis,,0,0,
gid://shopify/Product/7050058727557,OP: The History of Cheese Making in New York State,Eunice R. Stamm,,0,0,
gid://shopify/Product/7050061774981,OP: The Story of Typhoo and the Birmingham Tea Industry,Kenneth Williams,,0,0,
gid://shopify/Product/7052295209093,OP: A Passion for Chocolate,Maurice and Jean-Jacques Bernachon,,0,0,
gid://shopify/Product/7052302418053,OP: Growing Up on the Chocolate Diet,Lora Brody,,0,0,
gid://shopify/Product/7052304515205,OP: The German Pastry Bakebook,Margit Stoll Dutton,,0,0,
gid://shopify/Product/7052330336389,OP: The Art of Fine Baking,Paula Peck,,0,0,
gid://shopify/Product/7052331188357,OP: The Viennese Pastry Cookbook,Lilly Joss Reich,,0,0,
gid://shopify/Product/7052331942021,OP: The American Boulangerie,Pascal Rigo,,0,0,
gid://shopify/Product/7052333154437,OP: Old Fashioned Desserts,,,0,0,
gid://shopify/Product/7052335186053,"OP: Great Cakes, Great Pies & Tarts, and Great Cookies (3 vols)",Carole Walter,,0,0,
gid://shopify/Product/7059205718149,"Talk & Taste: Islas, A Celebration of Tropical Cooking with Von Diaz",,,0,0,
gid://shopify/Product/7059265683589,Tasteful: New Interiors for Restaurants and Cafes,Gestalten Editors,9783967041484,1,0,
gid://shopify/Product/7061430304901,Marine Fishes and Fisheries of New York,Howard M. Reisman and Emerson C. Hasbrouck Jr.,9781501774102,2,0,
gid://shopify/Product/7061814968453,La Table by Celine: Exquisite Food Art that Brings Nature to the Plate,Celine Rousseau,9783791389677,1,0,
gid://shopify/Product/7062147498117,OP: The Art of Peruvian Cuisine,Tony Custer,,0,0,
gid://shopify/Product/7062148219013,OP: El Arte de la Cocina Peruana,Tony Custer,,0,0,
gid://shopify/Product/7062148841605,OP: Brazilian Cookery,Margarette de Andrade,,0,0,
gid://shopify/Product/7062153396357,OP: Noshe Djan (hardcover),Helen Saberi,,0,0,
gid://shopify/Product/7062154412165,OP: Mi Cocina vols I and II,Armando Scannone,,0,0,
gid://shopify/Product/7062156279941,OP: Lithuanian Cookery,Izabele Sinkeviciute,,0,0,
gid://shopify/Product/7062159097989,OP: West Cretan Cooking,Nicholas Stavroulakis,,0,0,
gid://shopify/Product/7062163390597,OP: Cambodian Cooking,Sovan Boun Thuy,,0,0,
gid://shopify/Product/7062165061765,OP: The Best Foods of Russia (hardcover),Sonia Uvezian,,0,0,
gid://shopify/Product/7062166274181,OP: Cooking from the Caucasus (paperback),Sonia Uvezian,,0,0,
gid://shopify/Product/7062168010885,OP: Everybody Eats Well in Belgium Cookbook (hardcover),Ruth Van Waerebeek with Maria Robbins,,0,0,
gid://shopify/Product/7062168273029,OP: Everybody Eats Well in Belgium Cookbook (paperback),Ruth Van Waerebeek with Maria Robbins,,0,0,
gid://shopify/Product/7062211952773,Calendar: 2025 Molly Reeder Illustrated Calendar,Molly Reeder,,0,0,
gid://shopify/Product/7066818969733,OP: The Presidents' Cookbook,Poppy Cannon and Patricia Brooks,,0,0,
gid://shopify/Product/7066820280453,OP: Washington Cookbook,Marny Clifford,,0,0,
gid://shopify/Product/7066823917701,OP: The Congressional Cook Book,"The Congressional Club, compiler",,0,0,
gid://shopify/Product/7066824441989,OP: White House Cook Book,F. L. Gillette and Hugo Ziemann,,0,0,
gid://shopify/Product/7066825490565,OP: Presidential Cook Book,[F. L. Gillette and Hugo Ziemann],,0,0,
gid://shopify/Product/7066825883781,OP: The White House Family Cookbook,Henry Haller,,0,0,
gid://shopify/Product/7066826145925,OP: The First Ladies Cook Book,Parents’ Magazine,,0,0,
gid://shopify/Product/7066826473605,OP: A Treasury of White House Cooking,Francois Rysavy,,0,0,
gid://shopify/Product/7066827817093,OP: Entertaining in the White House,Marie Smith,,0,0,
gid://shopify/Product/7067523186821,McAtlas: A Global Guide to the Golden Arches (signed special edition),Gary He,9798986997636,0,0,
gid://shopify/Product/7069537075333,Talk & Taste: Second Generation with Jeremy Salamon,,,0,0,
gid://shopify/Product/7069560340613,Swing By!: Entertaining Recipes & the New Art of Gathering,Stephanie Nass,9780847829439,0,0,
gid://shopify/Product/7069560733829,Marie Belle Entertains: Savory and Sweet Recipes for Every Occasion from the Master Chocolatier,Lavinia Branca Snyder,9780847837229,0,0,
gid://shopify/Product/7072999374981,OP: Citron and Framboise (2 vols),Christophe Adam,,0,0,
gid://shopify/Product/7073025818757,OP: The Last Course,Claudia Fleming,,0,0,
gid://shopify/Product/7073027588229,The Balkan Kitchen: Recipes and Stories from the Heart of the Balkans,Irina Janakievska,9781784886851,2,0,
gid://shopify/Product/7073029947525,"Soup Meals: Soups to Feed Body, Soul & Friends",Emily Ezekiel,9781958417614,1,0,
gid://shopify/Product/7073314177157,OP: Up-to-Date Confectionery,Albert R. Daniel,,0,0,
gid://shopify/Product/7073314439301,OP: Stars Desserts,Emily Luchetti,,0,0,
gid://shopify/Product/7073315029125,OP: Pot Shots from a Grosse Ile Kitchen,Lucy and Sidney Corbett,,0,0,
gid://shopify/Product/7073315356805,OP: Ottolenghi Flavor (signed first printing),Yotam Ottolenghi and Itxta Belfrage,,0,0,
gid://shopify/Product/7073315651717,OP: Dorie's Cookies (signed first printing),Dorie Greenspan,,0,0,
gid://shopify/Product/7073315946629,OP: My Paris Kitchen (signed first printing),David Lebovitz,,0,0,
gid://shopify/Product/7073319387269,"The Elements of Baking: Making Any Recipe Gluten-Free, Dairy-Free, Egg-Free or Vegan",Katarina Cermelj,9781399712897,4,0,
gid://shopify/Product/7073320829061,OP: River Cafe London (signed first printing),Ruth Rogers and Rose Gray,,0,0,
gid://shopify/Product/7075585884293,"Talk & Taste: Salty, Cheesy, Herby, Crispy Snackable Bakes with Jessie Sheehan and Melissa Clark",,,0,0,
gid://shopify/Product/7085925269637,OP: Alinea (first printing),Grant Achatz,,0,0,
gid://shopify/Product/7085928513669,OP: One Day at The French Laundry/ One Day at Per Se,Bent Christensen,,0,0,
gid://shopify/Product/7085930348677,OP: Oaxen Adieu,Magnus Ek and Agneta Green,,0,0,
gid://shopify/Product/7085933461637,OP: Frantzen/Lindeberg,Bjorn Frantzen and Daniel Lindeberg,,0,0,
gid://shopify/Product/7085940048005,OP: Fish and Shellfish,Opt Art,,0,0,
gid://shopify/Product/7085942308997,OP: La Technique and La Methode (2 vols),Jacques Pepin,,0,0,
gid://shopify/Product/7085953319045,OP: Echaurran: El Sabor de la Memoria,Marisa Sánchez and Francis Paniego,,0,0,
gid://shopify/Product/7087493611653,Winter 2025 Cookbook Club,,,0,0,
gid://shopify/Product/7087511371909,Cookbook Club: Food of the Italian Islands,,,0,0,
gid://shopify/Product/7087526969477,Cookbook Club: Code Noir,,,0,0,
gid://shopify/Product/7087527657605,Cookbook Club: The Scottish Kitchen,,,16,0,
gid://shopify/Product/7088197632133,Cookbook Club Tasting: Simply West African,,,0,0,
gid://shopify/Product/7088326574213,OP: From My Mother's Kitchen (signed revised edition),Mimi Sheraton,,0,0,
gid://shopify/Product/7092658077829,Half Baked Harvest: Quick and Cozy,Tieghan Gerard,9780593232576,0,0,
gid://shopify/Product/7096914411653,Class: Bubbles!,,,0,0,
gid://shopify/Product/7097650118789,OP: The Antisocial Cookbook,Binaca,,0,0,
gid://shopify/Product/7097650217093,OP: Mets de Provence: Cuisine Provencale,Eugene Blancard,,0,0,
gid://shopify/Product/7097650380933,OP: The Penguin Elizabeth David Cookery Book Set (5 vols),Elizabeth David,,0,0,
gid://shopify/Product/7097650610309,OP: Secrets of Meat Curing and Sausage Making (fourth edition),B. Heller & Co.,,0,0,
gid://shopify/Product/7097651560581,OP: The Book of Sauces,C. Herman Senn,,0,0,
gid://shopify/Product/7097651953797,OP: The Vest Pocket Vegetable Book,Charles G. Moore,,0,0,
gid://shopify/Product/7097652150405,OP: A Selection of Dishes and the Chef's Reminder,Charles Fellows,,0,0,
gid://shopify/Product/7097652772997,OP: Plum Crazy: A Book About Beach Plums,Elizabeth Post Mirel,,0,0,
gid://shopify/Product/7097652936837,OP: The Daily Mail Cookery Book,Mrs. C. S. Peel,,0,0,
gid://shopify/Product/7097653133445,OP: Princess Pamela's Soul Food Cookbook,Princess Pamela [Strobel],,0,0,
gid://shopify/Product/7097653231749,OP: New Ways for Oysters,Sarah Tyson Rorer,,0,0,
gid://shopify/Product/7101691789445,Tables of Contents Digest 2023-2024,"Evan Hanzcor, Tanya Bush, and Sammi Katz",,20,0,
gid://shopify/Product/7102629970053,OP: Bideshi Baburchi,Julie Parshall,,0,0,
gid://shopify/Product/7102630133893,OP: American-Hindi Cook Book,"Faye Sollid, compiler",,0,0,
gid://shopify/Product/7102630199429,OP: Indian Cookery,Richard Terry,,0,0,
gid://shopify/Product/7102630297733,OP: Appu!! The Ceylon Cookery Book,Mrs. Churton H. Walker,,0,0,
gid://shopify/Product/7102631706757,OP: Cooking from the Heart,Sami Scripter and Sheng Yang,,0,0,
gid://shopify/Product/7102631903365,OP: The Melting Pot,"Susan Bass, et al., editor",,0,0,
gid://shopify/Product/7102672273541,OP: Hibachi Cookery in the American Manner,George E. Engler,,0,0,
gid://shopify/Product/7102770905221,OP: Kenya Cookery Book and Household Guide,Members of St. Andrew’s Church Woman’s Guild,,0,0,
gid://shopify/Product/7109382602885,Cookbook Club Chef's Kitchen: Burns Night Cook-Along (a daytime class),,,0,0,
gid://shopify/Product/7111575928965,OP: Cooking with Josephine,Josephine Araldo,,0,0,
gid://shopify/Product/7111578615941,OP: The Store Cookbook,Bert Greene and Denis Vaughan,,0,0,
gid://shopify/Product/7111578845317,OP: The Dione Lucas Book of French Cooking,Dione Lucas and Marion Gorman,,0,0,
gid://shopify/Product/7111579074693,OP: How America Eats,Clementine Paddleford,,0,0,
gid://shopify/Product/7111579205765,OP: The Art of South American Cooking,Felipe Rojas-Lombardi,,0,0,
gid://shopify/Product/7113790226565,OP: Venus in the Kitchen (1953),Pilaff Bey,,0,0,
gid://shopify/Product/7113791012997,OP: Venus in the Kitchen (2002),Norman Douglas,,0,0,
gid://shopify/Product/7113791471749,OP: Wedding Cakes and Cultural History,Simon R. Charsley,,0,0,
gid://shopify/Product/7113792684165,OP: La Table et l'Amour,Curnonsky and Andre Saint-Georges,,0,0,
gid://shopify/Product/7113793962117,OP: The Bordello Cookbook,Jo Foxworth,,0,0,
gid://shopify/Product/7113794486405,OP: The Bride's Cookery Book,Marjorie Claire Guy,,0,0,
gid://shopify/Product/7113795141765,OP: Cuisine de l'Amour,Charles Heartman,,0,0,
gid://shopify/Product/7113795960965,OP: A Thousand Ways to Please a Husband,Louise Bennett Weaver and Helen Cowles Le Cron,,0,0,
gid://shopify/Product/7113963733125,OP: The Artful Eater (paperback),Edward Behr,,0,0,
gid://shopify/Product/7113963995269,OP: An Omelette and a Glass of Wine,Elizabeth David,,0,0,
gid://shopify/Product/7113964126341,OP: In Search of the Perfect Meal,Roy Andries de Groot,,0,0,
gid://shopify/Product/7113964421253,OP: To Begin Again (hardcover),M. F. K. Fisher,,0,0,
gid://shopify/Product/7113964683397,OP: To Begin Again (paperback),M. F. K. Fisher,,0,0,
gid://shopify/Product/7113964978309,OP: Liebling Abroad,A. J. Liebling,,0,0,
gid://shopify/Product/7113965174917,OP: Gathering the Desert,Gary Paul Nabhan,,0,0,
gid://shopify/Product/7113965371525,"OP: Tender at the Bone (hardcover, signed)",Ruth Reichl,,0,0,
gid://shopify/Product/7120368337029,OP: Poet of the Appetites,Joan Reardon,,0,0,
gid://shopify/Product/7123104170117,Spring 2025 Cookbook Club: The Next Generation—Asian Heritage,,,21,0,
gid://shopify/Product/7123104530565,Cookbook Club: Korean American,,,18,0,
gid://shopify/Product/7123108233349,Cookbook Club: Amrikan,,,18,0,
gid://shopify/Product/7123109314693,Cookbook Club: Chinese Enough,,,16,0,
gid://shopify/Product/7126288597125,OP: Encyclopedia of Practical Gastronomy,Ali-Bab,,0,0,
gid://shopify/Product/7126288760965,OP: Gastronomie Pratique,Ali-Bab,,0,0,
gid://shopify/Product/7127384195205,OP: Art Culinaire #6,,,0,0,
gid://shopify/Product/7127432200325,"Class: Whisk(e)y Basics: Gaelic Roots, Modern Food Pairings",,,0,0,
gid://shopify/Product/7130646904965,OP: Lost Diners and Roadside Restaurants of New England and New York,Will Anderson,,0,0,
gid://shopify/Product/7130647658629,OP: Diners,John Baeder,,0,0,
gid://shopify/Product/7130647756933,OP: Diners (revised and updated),John Baeder,,0,0,
gid://shopify/Product/7130647986309,OP: The Streamliner Diner Cookbook,"Irene Clark, Liz Matteson, Alexandra Rust, and Judith Weinstock",,0,0,
gid://shopify/Product/7130648182917,OP: Roadside New Jersey,Peter Genovese,,0,0,
gid://shopify/Product/7130648346757,OP: American Diner Then and Now (signed),Richard J. S. Gutman,,0,0,
gid://shopify/Product/7130648477829,OP: American Diner Then and Now (unsigned),Richard J. S. Gutman,,0,0,
gid://shopify/Product/7130649034885,OP: Diners: People and Places,Gerd Kittel,,0,0,
gid://shopify/Product/7132480405637,Gateaux: Sweets,Mori Yoshida,9781962098120,2,0,
gid://shopify/Product/7133653565573,The Pastry Chef Handbook (Revised Edition): La Patisserie de Référence,Pierre Paul Zeiher and Jean Michel Truchelut,9782386220647,3,0,
gid://shopify/Product/7135441420421,Test Book Title,,,1,0,
gid://shopify/Product/7137323974789,OP: Rotis and Naans of India,Purobi Babbar,,0,0,
gid://shopify/Product/7137324564613,OP: Delicious Food for India,Marie Edwards,,0,0,
gid://shopify/Product/7137324957829,OP: Kerala Cookery,Mrs. K. M. Mathew,,0,0,
gid://shopify/Product/7137325285509,OP: The Menu Book,Anjani Naravane,,0,0,
gid://shopify/Product/7137325613189,OP: Potato Dishes,Pusa Institute Ladies’ Association,,0,0,
gid://shopify/Product/7137326137477,OP: Economical Cookery Book for India,Mrs. G. L. Routleff,,0,0,
gid://shopify/Product/7137326465157,OP: Indian Cookery,E. P. Veerasawmy,,0,0,
gid://shopify/Product/7137337737349,OP: The Compleat Housewife (1994),Eliza Smith,,0,0,
