Product ID,Title,Author/SKU,ISBN/Barcode,Inventory,Unfulfilled Qty,Collections
gid://shopify/Product/6683441528965,OP: Cheddar Gorge,"John Squire, editor",,0,0,
gid://shopify/Product/6683441889413,OP: Larkin Housewives' Cook Book,Larkin Company,,0,0,
gid://shopify/Product/6683442348165,OP: Roast Chicken and Other Stories,Simon Hopkinson,,0,0,
gid://shopify/Product/6683443429509,OP: Banana Cookbook,Reba E. Shepard,,0,0,
gid://shopify/Product/6683444183173,"OP: Love, Time, and Butter",Joe Hyde,,0,0,
gid://shopify/Product/6683446640773,OP: The Glorious Oyster,Hector Bolitho,,0,0,
gid://shopify/Product/6683450605701,"OP: Cucina Fresca, Pasta Fresca, and Cucina Rustica (3 vols)",Viana La Place and Evan Kleiman,,0,0,
gid://shopify/Product/6686344675461,The Last Bite: A Whole New Approach to Making Desserts Through the Year,Anna Higham,9780744056808,0,0,
gid://shopify/Product/6686938202245,OP: Bourgogne: Produits du Terroir et Recettes Traditionnelles,CNAC,,0,0,
gid://shopify/Product/6686938628229,OP: Nord Pas-de-Calais: Produits du Terroir et Recettes Traditionnelles,CNAC,,0,0,
gid://shopify/Product/6686938792069,OP: Provence-Alpes-Cote D'Azur: Produits du Terroir et Recettes Traditionnelles,CNAC,,0,0,
gid://shopify/Product/6688491569285,OP: Lucky Peach Complete Set (24 vols),"David Chang, Chris Ying, Peter Meehan",,0,0,
gid://shopify/Product/6688492322949,OP: Opt Art Magazine (6 vols),Opt Art,,0,0,
gid://shopify/Product/6688492945541,OP: Time Life Foods of the World Complete Series (27 book sets plus 4 supplements),Time Life,,0,0,
gid://shopify/Product/6688495173765,OP: L'Inventaire du Patrimonie Culinaire de la France (24 vols),Conseil National des Arts Culinaires (CNAC),,0,0,
gid://shopify/Product/6688707051653,Modernized Korean Desserts: Rice Blossoms,Jennifer L. Ban,9781792383038,0,0,
gid://shopify/Product/6689169899653,Please Wait to Be Tasted: The Lil’ Deb’s Oasis Cookbook,"Carla Perez-Gallardo, Hannah Black, and Wheeler",9781648960253,0,0,
gid://shopify/Product/6689379975301,Bread and My Thoughts,Ranit Shahar with Thomas Teffri-Chambelland,9782957261178,1,0,
gid://shopify/Product/6689460879493,OP: From Garden to Kitchen,C. H. Middleton and Ambrose Heath,,0,0,
gid://shopify/Product/6689460945029,OP: From a Breton Garden,Josephine Araldo and Robert Reynolds,,0,0,
gid://shopify/Product/6689461141637,OP: Lord Krishna's Cuisine,Yamuna Devi,,0,0,
gid://shopify/Product/6689461305477,OP: Cooking Through the Seasons,Joël Robuchon,,0,0,
gid://shopify/Product/6689461436549,OP: Greene on Greens,Bert Greene,,0,0,
gid://shopify/Product/6689462419589,OP: Summer Feasts,Molly Finn,,0,0,
gid://shopify/Product/6696039121029,OP: The Taste of America,John Hess and Karen Hess,,0,0,
gid://shopify/Product/6696039547013,OP: The Brooklyn Cookbook,Lyn Stallworth and Rod Kennedy,,0,0,
gid://shopify/Product/6696040431749,OP: We Called it Macaroni,Nancy Verde Barr,,0,0,
gid://shopify/Product/6696041906309,OP: American Regional Cookery,Sheila Hibben,,0,0,
gid://shopify/Product/6696042135685,OP: James Beard's American Cookery,James Beard,,0,0,
gid://shopify/Product/6696042299525,OP: Jane and Michael Stern's Coast-to-Coast Cookbook,Jane and Michael Stern,,0,0,
gid://shopify/Product/6698434560133,Heirloom Apples 1000 Piece Puzzle,"Galison, Julie Seabrook Ream",9780735375734,0,0,
gid://shopify/Product/6698436100229,Classic Cookbooks: 1000 Piece Puzzle,Richard Baker,9781648961700,0,0,
gid://shopify/Product/6700819480709,OP: The Yul Brynner Cookbook,Yul Brynner,,0,0,
gid://shopify/Product/6700819775621,OP: Les Diners de Gala,Salvador Dali,,0,0,
gid://shopify/Product/6700819873925,OP: Liberace Cooks!,Liberace and Carol Traux,,0,0,
gid://shopify/Product/6700966576261,OP: Recipes and Memories,Sophia Loren,,0,0,
gid://shopify/Product/6700966707333,OP: Candy Hits,ZaSu Pitts,,0,0,
gid://shopify/Product/6700968411269,OP: Alchemist's Cookbook (signed hardcover),Ahmed Yacoubi,,0,0,
gid://shopify/Product/6706919112837,OP: The China Moon Cookbook,Barbara Tropp,,0,0,
gid://shopify/Product/6706921078917,OP: Foods of Sicily and Sardinia,Giuliano Bugiali,,0,0,
gid://shopify/Product/6706922193029,OP: Flavorwalla,Floyd Cardoz,,0,0,
gid://shopify/Product/6706923143301,OP: Catalan Cuisine,Colman Andrews,,0,0,
gid://shopify/Product/6706929565829,OP: Arabesque,Claudia Roden,,0,0,
gid://shopify/Product/6706931433605,OP: The New Book of Middle Eastern Food,Claudia Roden,,0,0,
gid://shopify/Product/6706937561221,OP: Cooking of the Eastern Mediterranean,Paula Wolfert,,0,0,
gid://shopify/Product/6706939789445,OP: Momofuku,David Chang and Peter Meehan,,0,0,
gid://shopify/Product/6706942443653,OP: The Zuni Cafe Cookbook,Judy Rodgers,,0,0,
gid://shopify/Product/6708805173381,Honey Cake & Latkes: Recipes from the Old World by the Auschwitz-Birkenau Survivors,Auschwitz-Birkenau Memorial Foundation,9781595911230,1,0,
gid://shopify/Product/6714118176901,OP: Maida Heatter's Book of Great Chocolate Desserts,Maida Heatter,,0,0,
gid://shopify/Product/6726667141253,The Fulton Fish Market: A History,Jonathan H. Rees,9780231202565,12,0,
gid://shopify/Product/6727507148933,OP: The Hostess of To-Day,Linda Hull Larned,,0,0,
gid://shopify/Product/6727507509381,OP: The One Maid Book of Cookery,A. E. Congreve,,0,0,
gid://shopify/Product/6727507705989,OP: The Modern Housewife,Alexis Soyer,,0,0,
gid://shopify/Product/6727508361349,OP: The Housekeepers' New Cook Book,"Mrs. T. J. Kirkpatrick, ed.",,0,0,
gid://shopify/Product/6727508656261,OP: Common Sense in the Household,Marion Harland,,0,0,
gid://shopify/Product/6727509082245,OP: Imperial Cook Book,Grace Townsend,,0,0,
gid://shopify/Product/6727509540997,OP: Manners Culture and Dress,"Richard A. Wells, A. M.",,0,0,
gid://shopify/Product/6728250523781,OP: Art Culinaire #76,Art Culinaire,ART CU 76,0,0,
gid://shopify/Product/6728620703877,OP: Art Culinaire #44,Art Culinaire,ART CU 44,0,0,
gid://shopify/Product/6728627486853,OP: Art Culinaire #30,Art Culinaire,ART CU 30,0,0,
gid://shopify/Product/6728628568197,OP: Art Culinaire #24,Art Culinaire,ART CU 24,0,0,
gid://shopify/Product/6728628732037,OP: Art Culinaire #23,Art Culinaire,ART CU 23,0,0,
gid://shopify/Product/6728629518469,OP: Art Culinaire #20,Art Culinaire,ART CU 20,0,0,
gid://shopify/Product/6728630665349,OP: Art Culinaire #15,Art Culinaire,ART CU 15,0,0,
gid://shopify/Product/6728631189637,OP: Art Culinaire #13,Art Culinaire,ART CU 13,0,0,
gid://shopify/Product/6728631648389,OP: Art Culinaire #11,Art Culinaire,ART CU 11,0,0,
gid://shopify/Product/6728633909381,OP: Art Culinaire #9,Art Culinaire,ART CU 9,0,0,
gid://shopify/Product/6728634925189,OP: Art Culinaire #8,Art Culinaire,ART CU 8,0,0,
gid://shopify/Product/6728635187333,OP: Art Culinaire #7,Art Culinaire,ART CU 7,0,0,
gid://shopify/Product/6728635482245,OP: Art Culinaire #5,Art Culinaire,ART CU 5,0,0,
gid://shopify/Product/6728635842693,OP: Art Culinaire #4,Art Culinaire,ART CU 4,0,0,
gid://shopify/Product/6728636203141,OP: Art Culinaire #3,Art Culinaire,ART CU 3,0,0,
gid://shopify/Product/6734315257989,OP: So Good #16,Vilbo,SO GO 16,0,0,
gid://shopify/Product/6734334951557,OP: So Good #10,Vilbo,SO GO 10,0,0,
gid://shopify/Product/6734340653189,OP: So Good #9,Vilbo,SO GO 9,0,0,
gid://shopify/Product/6734344421509,OP: So Good #8,Vilbo,SO GO 8,0,0,
gid://shopify/Product/6734347010181,OP: So Good #7,Vilbo,SO GO 7,0,0,
gid://shopify/Product/6734355824773,OP: So Good #5,Vilbo,SO GO 5,0,0,
gid://shopify/Product/6737257922693,Rice Is Life: Recipes and Stories Celebrating the World's Most Essential Grain,Caryl Levine and Ken Lee,9781797214900,1,0,
gid://shopify/Product/6746061930629,OP: Art Culinaire #143,Art Culinaire,,0,0,
gid://shopify/Product/6748070248581,OP: Bartender's Guide,“Trader Vic” Bergeron,,0,0,
gid://shopify/Product/6748073361541,OP: Cocktail Wine and Digest,Oscar Haimo,,0,0,
gid://shopify/Product/6748074246277,OP: Gordon's Cocktail and Food Recipes,Harry Jerrold Gordon,,0,0,
gid://shopify/Product/6748075655301,OP: The Standard Cocktail Guide,Crosby Gaige,,0,0,
gid://shopify/Product/6748076212357,OP: 100 Cocktails How to Mix Them,"""Bernard""",,0,0,
gid://shopify/Product/6750271733893,The Little Black Book of Entertaining: A Recipe Journal and Resource Book for the Home Hostess,,WHILE ENT,8,0,
gid://shopify/Product/6751453380741,Cherry Bombe 20,Cherry Bombe Editors,CB20,2,0,
gid://shopify/Product/6754066858117,The Pastry Chef Handbook: Basic Techniques and Preparations,Jean Michel Truchelut and Pierre-Paul Zeiher,9782857089353,0,0,
gid://shopify/Product/6754196357253,The Anchor Brewing Story : America's First Craft Brewery & San Francisco's Original Anchor Steam Beer,David Burkhart,9780399581236,0,0,
gid://shopify/Product/6755046981765,OP: Espumas de Ferran  Adria,Ferran Adrià,,0,0,
gid://shopify/Product/6755057369221,OP: Essential Cuisine,Michel Bras,,0,0,
gid://shopify/Product/6755075195013,OP: Notes from a Kitchen (3 vols),Jeff Scott and Blake Beshore,,0,0,
gid://shopify/Product/6755312107653,OP: Comfort Me with Apples,Ruth Reichl,9780375501951,0,0,
gid://shopify/Product/6757106450565,Strawberry Fanny Farmer Tote Bag (limited edition),,,0,0,
gid://shopify/Product/6758722371717,Your Table Is Ready: Tales of a New York City Maître D' (hardcover),Michael Cecchi-Azzolina,9781250281982,0,0,
gid://shopify/Product/6759069155461,OP: Best of Christophe Adam,Ducasse Editions,,0,0,
gid://shopify/Product/6759069253765,OP: Best of Claire Heitzler,Ducasse Editions,,0,0,
gid://shopify/Product/6759069286533,OP: Best of Pierre Herme,Ducasse Editions,,0,0,
gid://shopify/Product/6759069450373,OP: Sweet Diversions,Yann Duytsche,,0,0,
gid://shopify/Product/6759069548677,OP: Un Amour de Macaron,Stéphane Glacier,,0,0,
gid://shopify/Product/6759069679749,OP: La Patisserie de Pierre Herme,Pierre Herme,,0,0,
gid://shopify/Product/6764926369925,Wild Herb Cookbook,Sami Tallberg,9789522204868,0,0,
gid://shopify/Product/6765053608069,OP: The Nero Wolfe Cookbook,Rex Stout,,0,0,
gid://shopify/Product/6766334083205,OP: Gastronomie Pratique,Ali-Bab,,0,0,
gid://shopify/Product/6766334279813,OP: Dinner in the Diner,Will C. Hollister,,0,0,
gid://shopify/Product/6767974580357,OP: Alchemist's Cookbook (paperback),Ahmed Yacoubi,,0,0,
gid://shopify/Product/6791271612549,La Merenda Italiana: Con i Migliori Salumi d'Italia,"Sabatino Sorrentino, editor",9788893970716,4,0,
gid://shopify/Product/6795891310725,OP: Paul Kovi's Transylvanian Cuisine,Paul Kovi,,0,0,
gid://shopify/Product/6797725827205,OP: Clementine In the Kitchen (1988 revised edition),Phineas Beck [Samuel Chamberlain],,1,0,
gid://shopify/Product/6797727694981,OP: The House of Chan Cookbook,Sou Chan,,0,0,
gid://shopify/Product/6797728120965,OP: Les Meilleures Recettes Culinaires pour Poissons et Crustaces,Le Comité Boulonnais de Propagande pour Consommation des Produits de la Mer,,0,0,
gid://shopify/Product/6797729104005,OP: The Teenie Weenies,William Donahey and Effie Baker,,0,0,
gid://shopify/Product/6797729398917,OP: It's Fun to Cook,Lucy Mary Maltby,,0,0,
gid://shopify/Product/6797729595525,OP: Loaves and Fishes Cookbook (first printing),Anna Pump,,0,0,
gid://shopify/Product/6797730283653,OP: Food for Beauty,Helena Rubinstein,,0,0,
gid://shopify/Product/6797730447493,OP: Thrifty Cooking for Wartime,Alice B. Winn-Smith,,0,0,
gid://shopify/Product/6802878824581,OP: Trader Vic's Kitchen Kibitzer,“Trader Vic” Bergeron,,0,0,
gid://shopify/Product/6802878890117,OP: Fearless Cooking for Men,Michele Evans,,0,0,
gid://shopify/Product/6802879316101,OP: Bull Cook and Authentic Historical Recipes and Practices,George Leonard Herter,,0,0,
gid://shopify/Product/6802879807621,OP: Wolf In Chef's Clothing,"Robert Loeb, Jr.",,0,0,
gid://shopify/Product/6802879938693,OP: Sunday Breakfast: A Cookbook for Men,Craig Michaels,,0,0,
gid://shopify/Product/6802880036997,OP: A Man's Cookbook,Raymond Oliver,,0,0,
gid://shopify/Product/6802880200837,OP: The Bachelor and the Chafing Dish,Deshler Welch,,0,0,
gid://shopify/Product/6807328489605,OP: Fruit: A Connoisseur's Guide,Alan Davidson,,0,0,
gid://shopify/Product/6807328817285,OP: With Bold Knife and Fork,M.F.K. Fisher,,0,0,
gid://shopify/Product/6807329276037,OP: The New Making of a Cook,Madeleine Kamman,,0,0,
gid://shopify/Product/6807330062469,OP: In Pursuit of Flavor,Edna Lewis,,0,0,
gid://shopify/Product/6811668676741,OP: A Taste of Japan,Donald Richie,,0,0,
gid://shopify/Product/6812984082565,OP: The Seducer's Cookbook,Mimi Sheraton,,0,0,
gid://shopify/Product/6812985098373,OP: Hors D'Oeuvres and Appetizers,Mimi Sheraton,,0,0,
gid://shopify/Product/6812985884805,OP: The Whole World Loves Chicken Soup (signed first printing),Mimi Sheraton,,0,0,
gid://shopify/Product/6812986048645,OP: The Whole World Loves Chicken Soup,Mimi Sheraton,,0,0,
gid://shopify/Product/6812986900613,OP: Food Markets of the World,Nelli Sheffer and Mimi Sheraton,,0,0,
gid://shopify/Product/6813021241477,OP: Art Culinaire #145,Art Culinaire,074470837022,0,0,
gid://shopify/Product/6813565485189,OP: White Towers,Paul Hirshorn and Steven Izenour,9780262083683,0,0,
gid://shopify/Product/6815188484229,OP: Ciro and Sal's Cookbook,Ciro Cozzi,,0,0,
gid://shopify/Product/6815384993925,Bread Banter: Soda Bread Recipes and a Peek Into Irish Culture,April Gertler,,0,0,
gid://shopify/Product/6816804503685,OP: What Shall We Have Today?,Xavier Marcel Boulestin,,0,0,
gid://shopify/Product/6816856834181,OP: Meatless Meals,Jean Prescott Adams,,0,0,
gid://shopify/Product/6816858800261,OP: Fashions in Foods in Beverly Hills,compiled by the Beverly Hills Woman’s Club,,0,0,
gid://shopify/Product/6816859291781,OP: Macy's Cook Book,Mabel Claire,,0,0,
gid://shopify/Product/6816859586693,OP: Good Housekeeping Cook Book,Good Housekeeping,,0,0,
gid://shopify/Product/6816859652229,OP: Coffee and Waffles,Alice Foote MacDougall,,0,0,
gid://shopify/Product/6816859717765,OP: A Cocktail Continentale,Bruce Reynolds,,0,0,
gid://shopify/Product/6820019634309,Season to Taste: Rewriting Kitchen Space in Contemporary Women's Food Memoirs,Caroline J. Smith,9781496845627,8,0,
gid://shopify/Product/6821307416709,OP: All the King's Cooks: The Tudors Kitchens of King Henry VIII at Hampton Court Palace,Peter Brears,,0,0,
gid://shopify/Product/6821311512709,OP: Royal Cookbook: Favorite Court Recipes From the World's Royal Families,"Robert H. Doherty, editor",,0,0,
gid://shopify/Product/6821313806469,OP: Cooking of the Maharajas,Shivaji Rao and Shalini Devi Holkar,,0,0,
gid://shopify/Product/6821316165765,OP: The Royal Cookery Book in Colour,Mrs. McKee,,0,0,
gid://shopify/Product/6821317640325,OP: Fit for a King: The Elvis Presley Cookbook,"Elizabeth McKeon, Ralph Gevirtz, and Julie Bandy",,0,0,
gid://shopify/Product/6821322326149,OP: Cooking for Madam,Marta Sgubin and Nancy Nicholas,,0,0,
gid://shopify/Product/6823828619397,The Hog Island Book of Fish & Seafood: Culinary Treasures from Our Waters,John Ash,9781951836870,1,0,
gid://shopify/Product/6828688900229,OP: Cross Creek Cookery,Marjorie Kinnan Rawlings,,0,0,
gid://shopify/Product/6830900019333,OP: Dirt Candy (signed),Amanda Cohen,,0,0,
gid://shopify/Product/6830900281477,OP: Food of Sichuan (signed),Fuchsia Dunlop,,0,0,
gid://shopify/Product/6830900478085,OP: The River Cottage Cookbook (signed),Hugh Fearnley-Whittingstall,,0,0,
gid://shopify/Product/6830900904069,OP: Cook Like a Pro (signed),Ina Garten,,0,0,
gid://shopify/Product/6830902640773,OP: Jane Grigson's Book of European Cookery (signed first printing),Jane Grigson,,0,0,
gid://shopify/Product/6830902706309,OP: Prune (signed),Gabrielle Hamilton,,0,0,
gid://shopify/Product/6830903001221,OP: Pok Pok Noodles (signed bookplate),Andy Ricker with JJ Goode,,0,0,
gid://shopify/Product/6830903066757,OP: Aquavit,Marcus Samuelsson,,0,0,
gid://shopify/Product/6830903099525,OP: You and I Eat the Same (signed),edited by Chris Ying,,0,0,
gid://shopify/Product/6833334616197,OP: Mrs. Gilpin's Frugalities,Susan Anna Brown,,0,0,
gid://shopify/Product/6833334714501,OP: Catering for Two,Alice L. James,,0,0,
gid://shopify/Product/6833334878341,OP: Practical Carving,Thomas J. Murrey,,0,0,
gid://shopify/Product/6833335009413,"OP: A ""Calendar of Dinners"" with 615 Recipes",Marion Harris Neil,,0,0,
gid://shopify/Product/6833335206021,OP: Home Candy Making,Mrs. S. T. Rorer,,0,0,
gid://shopify/Product/6833338843269,OP: The Young Housekeeper's Friend,Mrs. [Mary Hooker] Cornelius,,0,0,
gid://shopify/Product/6833339105413,OP: Practical Cooking and Dinner-Giving,Mary F. Henderson,,0,0,
gid://shopify/Product/6833339269253,OP: The American Practical Cookery Book,a Practical Housekeeper,,0,0,
gid://shopify/Product/6833339629701,OP: A New System of Domestic Cookery,A Lady [Maria Eliza Rundell],,0,0,
gid://shopify/Product/6833340186757,OP: Dorcas Dishes,"Kate Douglas Wiggin, editor",,0,0,
gid://shopify/Product/6837093695621,OP: A Fistful of Lentils,Jennifer Abadi,,0,0,
gid://shopify/Product/6837095628933,OP: A Russian Jew Cooks in Peru,Violeta Autumn,,0,0,
gid://shopify/Product/6837100740741,OP: Cookbook of the Jews of Greece,Nicholas Stavroulakis,,0,0,
gid://shopify/Product/6837208711301,The Greens Cookbook: Extraordinary Vegetarian Cuisine,Deborah Madison,9781911667483,1,0,
gid://shopify/Product/6838726852741,OP: Invitation to Indian Cooking,Madhur Jaffrey,,0,0,
gid://shopify/Product/6838733406341,OP: Pasta Fresca (hardcover),Viana La Place & Evan Kleiman,,0,0,
gid://shopify/Product/6839484350597,Teatime Scones,Teatime Magazine,9780983598480,1,0,
gid://shopify/Product/6840607080581,Talk & Taste: The Dominican Kitchen with Vanessa Mota,Event at Essex Market-1,,0,0,
gid://shopify/Product/6840883544197,"Voilà Vegan: 85 Decadent, Secretly Plant-Based Desserts from an American Pâtisserie in Paris",Amanda Bankert,9780593538654,0,0,
gid://shopify/Product/6844147302533,OP: The Princesses Cook Book,Jenny Akerstrom,,0,0,
gid://shopify/Product/6844149334149,OP: Fancy Ices,A.B. Marshall,,0,0,
gid://shopify/Product/6844151365765,OP: Mythology and Meatballs (hardcover),Daniel Spoerri,,0,0,
gid://shopify/Product/6844152447109,OP: Mythology and Meatballs (paperback),Daniel Spoerri,,0,0,
gid://shopify/Product/6844153266309,OP: The Ultimate Mousse Cookbook,Jack Stone and Janet Cassidy,,0,0,
gid://shopify/Product/6844154249349,OP: Hamburger Heaven (hardcover),Jeffrey Tennyson,,0,0,
gid://shopify/Product/6844155134085,OP: Hamburger Heaven (paperback),Jeffrey Tennyson,,0,0,
gid://shopify/Product/6844694560901,Thank a Farmer,Maria Gianferrari with illustrations by Monica Mikai,9781324015796,0,0,
gid://shopify/Product/6844776251525,The Plain Cake Appreciation Society: 52 Weeks of Cake,Tilly Pamment,9781922616685,0,0,
gid://shopify/Product/6846336336005,Cookbook Club,CKBKCLB,,0,0,
gid://shopify/Product/6846887723141,"Cali Baja Cuisine: Tijuana Tacos, Ensenada Aguachiles, San Diego Cali Burritos + More",Michael A. Gardiner,9780847873555,1,0,
gid://shopify/Product/6846962925701,Fall 2023 Cookbook Club,Full Season Fall 2023,,0,0,
gid://shopify/Product/6846963089541,Cookbook Club: Simply West African,Cookbook Club Fall 2023 October,,0,0,
gid://shopify/Product/6846963220613,Cookbook Club: Food52 Simply Genius,Cookbook Club Fall 2023 November,,0,0,
gid://shopify/Product/6846963253381,Cookbook Club: Portico,Cookbook Club Fall 2023 December,,0,0,
gid://shopify/Product/6847373246597,Class: Big Time Apples—An Interactive Food and Drink Experience,"Wander, Eat and Tell Experiences",,0,0,
gid://shopify/Product/6849073184901,Fermenter: DIY Fermentation for Vegan Fare,Aaron Adams and Liz Crain,9781632174710,0,0,
gid://shopify/Product/6849127481477,"Store Front NYC: Photographs of the City's Independent Shops, Past and Present",James Murray and Karla Murray,9783791389646,1,0,
gid://shopify/Product/6849350107269,Crave: Bold Recipes That Make You Want Seconds,Karen Akunowicz,9781682687055,0,0,
gid://shopify/Product/6849408761989,OP: Cooking in Old Creole Days (1904),Celestine Eusits,,0,0,
gid://shopify/Product/6849409187973,OP: The Picayune's Creole Cook Book,The Picayune,,0,0,
gid://shopify/Product/6849412726917,OP: Mme. Begue's Recipes of Old New Orleans Creole Cookery,Madame Begue [Elizabeth Kettenring],,0,0,
gid://shopify/Product/6849412890757,OP: New Orleans Recipes,Mary Moore Bremer,,0,0,
gid://shopify/Product/6849413087365,OP: Creole Cook Book,Lafcidio Hearn,,0,0,
gid://shopify/Product/6849413218437,OP: The Plantation Cookbook,The Junior League of New Orleans,,0,0,
gid://shopify/Product/6849413415045,OP: Plantation Cookery of Old Louisiana,Eleanor Ott,,0,0,
gid://shopify/Product/6849429602437,OP: My Prize Winning Recipes,Mrs. [Melanie] George A. Chehardy,,0,0,
gid://shopify/Product/6849570930821,Eater: 100 Essential Restaurant Recipes from the Authority on Where to Eat and Why It Matters,Hillary Dixler Canavan,9781419765766,0,0,
gid://shopify/Product/6849572176005,"Every Season Is Soup Season: 85+ Souper-Adaptable Recipes to Batch, Share, Reinvent, and Enjoy",Shelly Westerhausen Worcel and Wyatt Worcel,9781797220307,1,0,
gid://shopify/Product/6850267840645,"Korean Home Cooking: 100 Authentic Everyday Recipes, From Bulgogi to Bibimbap",Jina Jung,9781922616920,0,0,
gid://shopify/Product/6851080880261,"Book of Sichuan Chili Crisp, The: Spicy Recipes and Stories from Fly by Jing's Kitchen",Jing Gao,9781984862174,0,0,
gid://shopify/Product/6851081175173,Lidia's: From Our Family Table to Yours,"Lidia Matticchio, Tanya Bastianich Manuali",9780525657422,0,0,
gid://shopify/Product/6858131439749,"East Winds: Recipes, History and Tales from the Hidden Caribbean",Riaz Phillips,9780241552438,1,0,
gid://shopify/Product/6858470490245,OP: Traite de Patisserie Moderne,Émile Darenne and Émile Duval,,0,0,
gid://shopify/Product/6858470981765,OP: Traite General de Confiserie Moderne,Émile Duval,,0,0,
gid://shopify/Product/6858471506053,OP: Pastry-Making and Confectionery,Emile Herisse and Herman Senn,,0,0,
gid://shopify/Product/6858471866501,OP: Le Memorial de la Patisserie,Pierre Lacam,,0,0,
gid://shopify/Product/6858970038405,"Pâtisserie Gluten Free: The Art of French Pastry: Cookies, Tarts, Cakes, and Puff Pastries",Patricia Austin,9781510776562,0,0,
gid://shopify/Product/6858971742341,The Plant-Based Diabetes Cookbook: 125+ Nourishing Recipes to Satisfy Every Taste Bud,"Jackie Newgent, RDN, CDN",9780757324826,0,0,
gid://shopify/Product/6859009032325,Talk & Taste: Farm To City To Table—How The City Eats Fresh,Event at Essex Market-1,,0,0,
gid://shopify/Product/6859101503621,The Best American Food Writing 2023,"Mark Bittman, editor",9780063322523,2,0,
gid://shopify/Product/6859112349829,"The Vegan Baker: The Ultimate Guide to Plant-Based Breads, Pastries, Cookies, Slices, and More",Zacchary Bird,9781922754554,0,0,
gid://shopify/Product/6859122573445,Remember 28ºC,Jose Romero,9788412571677,0,0,
gid://shopify/Product/6862448853125,Sweet Vietnamese Bakes: A Dessert Lover's Tour of Southeast Asia,Tara Nguyen,9781645678090,1,0,
gid://shopify/Product/6862510588037,"Let's Bake Bread!: A Family Cookbook to Foster Learning, Curiosity, and Skill Building in Your Kids",Bonnie Ohara,9781648290572,0,0,
gid://shopify/Product/6862511407237,Let's Eat Paris!: The Essential Guide to the World's Most Famous Food City,François-Régis Gaudry,9781648293214,2,0,
gid://shopify/Product/6862513307781,Milk Street Simple,Christopher Kimball,9780316538558,1,0,
gid://shopify/Product/6866417483909,Istanbul Cult Recipes,Pomme Larmoyer,9781922616999,0,0,
gid://shopify/Product/6866508710021,Surplus: The Food Waste Guide for Chefs,Vojtech Végh,9798585417832,0,0,
gid://shopify/Product/6868168736901,OP: Sergio (3 vols),Sergio Herman,,0,0,
gid://shopify/Product/6868169162885,OP: Central,Virgilio Martínez,,0,0,
gid://shopify/Product/6868170801285,OP: El Celler De Can Roca: the Book (second printing),"Joan, Jordi, and Josep Roca",9788493891084,0,0,
gid://shopify/Product/6872795316357,Suss: Sweet German Treats for Every Occasion,Audrey Leonard,9781645678892,3,0,
gid://shopify/Product/6874212008069,Winter 2024 Cookbook Club,Full Season Winter 2024,,0,0,
gid://shopify/Product/6874212171909,Cookbook Club: Ever-Green Vietnamese,Cookbook Club Winter 2024 January,,0,0,
gid://shopify/Product/6874212335749,Cookbook Club: The Food of Sichuan,Cookbook Club Winter 2024 February,,0,0,
gid://shopify/Product/6874215415941,Cookbook Club: Bravetart,Cookbook Club Winter 2024 March,,0,0,
gid://shopify/Product/6874219937925,Talk & Taste: German-Jewish Holiday Celebration,Event at Essex Market-1,,0,0,
gid://shopify/Product/6875482882181,OP: The Molly Goldberg Jewish Cookbook,Gertrude Berg and Myra Waldo,,0,0,
gid://shopify/Product/6875496579205,OP: Typhoid Mary,Anthony Bourdain,,0,0,
gid://shopify/Product/6875500642437,OP: Lowney's Cook Book,Maria Willett Howard,,0,0,
gid://shopify/Product/6875501199493,OP: Chinese Gastronomy (hardcover),Hsiang Ju Lin and Tsuifeng Lin,,0,0,
gid://shopify/Product/6875501592709,OP: Chinese Gastronomy (paperback),Hsiang Ju Lin and Tsuifeng Lin,,0,0,
gid://shopify/Product/6875756068997,The French Chef Cookbook,Julia Child,9780593537473,0,0,
gid://shopify/Product/6875760558213,"Kugels and Collards: Stories of Food, Family, and Tradition in Jewish South Carolina",Rachel Gordin Barnett and Lyssa Kligman Harvey,9781643364216,2,0,
gid://shopify/Product/6882677751941,OP: The Vilna Vegetarian Cookbook,Fania Lewando,,0,0,
gid://shopify/Product/6882678210693,OP: La Cuisine est un Jeu d'Enfants,Michel Oliver,,0,0,
gid://shopify/Product/6883895509125,La cocina como tecnica cultural/Cooking as a Cultural Technique: Rosetta Cuadernos/Notebooks 7,Markus Krajewski,,2,0,
gid://shopify/Product/6894614904965,The Silver Spoon Pasta: Authentic Italian Recipes,The Silver Spoon Kitchen,9780714865980,2,0,
gid://shopify/Product/6896125149317,Spring 2024 Cookbook Club,,,0,0,
